"Prior to their latest sentencing, all three practitioners have been repeatedly targeted for their faith in the past two decades.","Trước lần kết án gần đây nhất, cả ba học viên này đã nhiều lần trở thành mục tiêu bức hại vì đức tin của họ trong hai thập kỷ qua."
Ms. Ruan,Bà Nguyễn
She almost died from the torture at Fujian Province Women’s Prison in January 2006.,Bà từng suýt chết vì bị tra tấn trong Nhà tù Nữ Tỉnh Phúc Kiến vào tháng 1 năm 2006.
"Her daughter, also a Falun Gong practitioner, was also given one year of forced labor and later seven years in prison.","Con gái của bà, cũng là một học viên Pháp Luân Công, cũng bị kết án 1 năm lao động cưỡng bức, sau đó là 7 năm tù."
"Their other family members were also subjected to long-term surveillance and harassment by police, unable to live a normal life.","Người nhà bà cũng bị cảnh sát theo dõi và sách nhiễu trong thời gian dài, nên không thể sống một cuộc sống bình thường."
Ms. Chen,Bà Trần
Ms. Chen is retired a bank manager.,Bà Trần Tinh Quang (陈星光) là một cựu giám đốc ngân hàng đã nghỉ hưu.
Her numerous illnesses also disappeared after she took up Falun Gong in May 1997.,Vô số bệnh tật của bà đã biến mất sau khi bà tu luyện Pháp Luân Công vào tháng 5 năm 1997.
Her home was raided five times.,Nhà bà đã bị lục soát năm lần.
She was held in a brainwashing center once and detention center five times.,Bà đã bị giam giữ tại một trung tâm tẩy não một lần và trại tạm giam năm lần.
"She served time at two labor camps for a total of three years and ten months, as well as two prison terms of five and three and a half years, respectively.","Bà đã thụ án ở hai trại lao động tổng cộng là 3 năm 10 tháng, và hai lần ngồi tù lần lượt là 5 năm và 3,5 năm."
"While serving time at the Fujian Province Women’s Prison, Ms. Chen was frequently held in solitary confinement, dragged around, forced to wear a straitjacket and hung up.","Trong thời gian thụ án tại Nhà tù Nữ Tỉnh Phúc Kiến, bà Trần thường xuyên bị biệt giam, bị lôi đi khắp nơi, bị cưỡng chế trói bằng áo trói bệnh nhân tâm thần và treo lên."
The guards subjected her to the “flying an airplane” torture almost every day.,Các lính canh đã tra tấn bà bằng cách bắt bà thực hiện tư thế “lái máy bay” gần như hàng ngày.
"In the torture, they forced her to bend her head down until it couldn’t go any further, while pulling her hands up behind her back and held at the highest point against the wall.","Trong khi tra tấn, chúng bắt bà phải cúi đầu xuống hết mức, đồng thời kéo hai tay bà ra sau lưng cho giơ lên sát tường."
Torture illustration: “Flying an Airplane”,Minh họa tra tấn: “Lái máy bay”
Ms. Lin,Bà Lâm
"After she grew up, Ms. Lin contracted cholecystitis (inflammation of the gallbladder), gallstones, and scrofula (swollen spots in her neck due to infections in her lymph nodes).","Lớn lên, bà Lâm mắc bệnh viêm túi mật, sỏi mật, và tràng nhạc (một dạng bệnh lao do viêm hạch bạch huyết)."
She began practicing Falun Gong in 1997 at her mother’s recommendation.,"Năm 1997, bà bắt đầu tu luyện Pháp Luân Công, khi được mẹ bà hồng Pháp."
"Before she knew it, the swollen spots in her neck were gone, and she no longer felt pain in her gallbladder.","Những nốt viêm ở cổ đã biến mất, túi mật cũng hết đau khi bà còn chưa kịp nhận ra."
She was able to sleep soundly and truly felt the joy of being illness-free.,Bà đã có thể ngủ ngon và thực sự cảm nhận được niềm vui thoát khỏi bệnh tật.
"After the persecution of Falun Gong began in 1999, she was detained twice prior to her latest arrest, for 15 and 24 days, respectively, and given one year of forced labor.","Sau khi cuộc bức hại Pháp Luân Công bắt đầu vào năm 1999, bà đã bị giam giữ hai lần lần lượt là 15 và 24 ngày, và bị phạt một năm lao động cưỡng bức, trước lần bắt giữ gần đây nhất."
"Ms. Li Fengying, 51, from Wulian County, Shandong Province was sent to the Shandong Province Women’s Prison (located in the capital city of Jinan) on August 8, 2023, despite her frail health."," Bà Lý Phượng Anh (51 tuổi), ngụ tại huyện Ngũ Liên, tỉnh Sơn Đông) đã bị đưa vào Nhà tù Nữ Tỉnh Sơn Đông (nằm ở thủ phủ Tế Nam) vào ngày 8 tháng 8 năm 2023, dù sức khỏe của bà rất yếu."
"Just days later, Ms. Li had to be rushed to the Qilu Hospital of Shandong University.","Chỉ vài ngày sau, bà Lý đã được cấp tốc đưa đến Bệnh viện Tề Lỗ của Đại học Sơn Đông."
It is believed she is still hospitalized at the time of this report.,Được biết tại thời điểm viết báo cáo này bà ấy vẫn còn đang nằm viện.
"After she was detained for nearly ten months at the Rizhao City Detention Center, Ms. Li became emaciated and weak, but the police still transferred her to the prison on August 8.","Ngày 15 tháng 5 năm 2023, cả 5 người trong số họ đều bị kết án tù."
"A staffer there condemned the police for still trying to jail a person in such precarious health, but the prison authorities decided to admit her anyway.",Bà Lý bị tuyên án nặng nhất với 8 năm tù và phạt tiền 20.000 nhân dân tệ.
"Later that day, the police also arrested Mr. Wang Hongwu, Ms. Wang Shihua, and Ms. Yang Mingzhen.","Ngày 10 tháng 10 năm 2022, bà Lý và bà Trịnh Doãn Mỹ lần đầu tiên bị bắt sau khi bị một người bán trái cây tố cáo vì đã nói chuyện với anh ta về Pháp Luân Công."
All five practitioners were interrogated in the police station and then taken to the Rizhao City Detention Center.,"Cảnh sát đã lục soát nhà của cả hai người phụ nữ và tịch thu các sách Pháp Luân Công, tài liệu thông tin, máy tính xách tay và máy in của họ."
"Ms. Yang is from Weifang City but moved to Wulian County, which is under the administration of Rizhao City, to avoid police harassment.","Cuối ngày hôm đó, cảnh sát cũng bắt giữ ông Vương Hồng Vũ, bà Vương Thế Hoa và bà Dương Minh Trân."
The other four practitioners are from Wulian.,Cả năm học viên đều bị thẩm vấn tại đồn công an và sau đó bị đưa đến trại tạm giam Thành phố Nhật Chiếu.
"A 75-year-old resident of Guanghan City, Sichuan Province was sentenced to one year with a 3,000-yuan fine on June 30, 2023, for his faith in Falun Gong, a mind-body practice that has been persecuted by the Chinese Communist Party since July 1999."," Ngày 30 tháng 6 năm 2023, một cư dân 75 tuổi ở thành phố Quảng Hán, tỉnh Tứ Xuyên đã bị kết án một năm tù giam cùng với 3.000 Nhân dân tệ tiền phạt vì đức tin của ông vàoPháp Luân Công, môn tu luyện đã bị Đảng Cộng sản Trung Quốc (ĐCSTQ) bức hại từ tháng 7 năm 1999."
"Mr. Liu Mingde was arrested at home on September 29, 2022, after a surveillance camera recorded him distributing Falun Gong informational materials in nearby Shifang City the day before.","Ông Lưu Minh Đức bị bắt cóc tại nhà vào ngày 29 tháng 9 năm 2022, sau khi bị một camera giám sát ghi hình ông đang phát tặng các tài liệu thông tin Pháp Luân Công ở gần thành phố Thập Phương trước đó một ngày."
The four arresting officers from the Shifang City Police Department also confiscated his Falun Gong book and some informational materials.,Bốn cảnh sát của Sở Công an Thành phố Thập Phương cũng đã tịch thu sách Pháp Luân Công cùng một số tài liệu thông tin của ông.
They took him to the local police station for interrogation.,Họ đưa ông tới đồn cảnh sát địa phương để thẩm vấn.
"He was released hours later, only to be arrested and taken to the same police station again on October 30, 2022.","Sau đó vài giờ, ông được trả tự do và rồi lại bị bắt giữ và bị đưa tới cùng đồn công an vào ngày 30 tháng 10 năm 2022."
"Mr. Liu was released later, though the exact date was unknown.",Ông Lưu sau đó đã được thả mặc dù không biết chính xác là vào ngày nào.
"Several people from the Shifang City Police Department and the Shifang CityProcuratoratecame to Mr. Liu’s home on March 1, 2023.","Ngày 1 tháng 3 năm 2023, một số nhân viên của Sở Công an Thành phố Thập Phương và Viện Kiểm sát Thành phố Thập Phương đã tới nhà ông Lưu."
They said that his case was considered a minor case and thus didn’t call for a prison sentence.,"Họ nói rằng vụ việc của ông được coi là không nghiêm trọng, vậy nên không yêu cầu phạt tù."
"As long as he signed the paperwork they prepared, they’d only give him a six-month house arrest or other lighter punishments.",Chỉ cần ông ký vào giấy tờ mà họ chuẩn bị thì ông chỉ bị quản thúc tại nhà 6 tháng hoặc các hình phạt nhẹ hơn.
Mr. Liu fell victim to their deceit and signed the paperwork without being allowed to read what was written there.,Ông Lưu trở thành nạn nhân của trò gian dối này và đã ký vào giấy tờ mà không được phép đọc nội dung trong đó.
"The Shifang City Court sentenced Mr. Liu to one year on June 30, 2023.","Ngày 30 tháng 6 năm 2023, Tòa án Thành phố Thập Phương kết án ông Lưu một năm tù giam."
He realized that the paperwork he signed had been used as evidence against him.,"Lúc này, ông mới nhận ra rằng những giấy tờ mà ông đã ký được dùng làm bằng chứng chống lại ông."
The details of his trial remain unknown.,Hiện vẫn chưa rõ chi tiết về phiên tòa xét xử ông Lưu.
Mr. Liu was allowed to serve time outside of prison but prohibited from going to Shifang City during his one-year term.,Ông Lưu được phép thụ án treo nhưng không được phép rời khỏi thành phố Thập Phương trong thời gian một năm thi hành bản án.
This is not the first time that Mr. Liu has been persecuted for his faith.,Đây không phải là lần đầu tiên ông Lưu bị bức hại vì đức tin của mình.
"In early 2001, the Guanghan City610 Officeset up brainwashing centers across its subordinate towns and villages, and more than 100 local Falun Gong practitioners were taken to those facilities at one point or another.","Vào đầu năm 2001,Phòng 610Thành phố Quảng Hán đã lập lên nhiều trung tâm tẩy não từ thành thị tới nông thôn, và hơn 100 học viên Pháp Luân Công địa phương đã bị đưa tới những cơ sở này."
Mr. Liu was held at the Xigao Town Brainwashing Center from early January to late April that year.,Ông Lưu bị giam tại Trung tâm tẩy não Thị trấn Tây Cao từ đầu tháng 1 tới cuối tháng 4 năm đó.
Mr. Liu and other practitioners were subjected to abuse during their detention.,Ông Lưu và nhiều học viên khác đã bị ngược đãi trong khi tạm giam.
"They were beaten, verbally abused, deprived of sleep, body searched, or forced to listen to loud noises for extended periods of time.","Họ bị đánh đập, lăng mạ, cấm ngủ, khám xét thân thể hoặc bị ép nghe âm thanh âm lượng lớn trong thời gian dài."
They were only given two meals each day in the beginning.,"Ban đầu, hàng ngày họ chỉ được ăn hai bữa."
Each meal only had a bit of porridge with napa cabbage or Chinese radish blanched in salt water.,Mỗi bữa chỉ có một chút cháo với ít cải thảo hoặc củ cải luộc với nước muối.
"The practitioners were later given three meals a day, but it was still the same porridge.","Sau đó, mỗi ngày các học viên được ăn ba bữa nhưng vẫn là món cháo như cũ."
"Mr. Liu was arrested again on June 20, 2011, and taken to the same brainwashing center.","Vào ngày 20 tháng 6 năm 2011, ông Lưu bị bắt cóc lần nữa và bị đưa đến cùng một trung tâm tẩy não."
"After 16 days there, he was transferred to the Guanghan City Detention Center, where he was held for 237 days.","Sau 16 ngày ở đó, ông đã được chuyển đến Trại giam Thành phố Quảng Hán, nơi ông bị giam trong 237 ngày."
The detention center guards beat Mr. Liu savagely and didn’t give him any food or water for some time.,Các lính canh của trại tạm giam đã đánh đập ông Lưu một cách dã man và không cho ông ăn uống trong một thời gian.
"A 55-year-old woman in Qingyuan County, Liaoning Province, was admitted to Dabei Prison in Shenyang (the capital city of the province) on July 26, 2023, four months after she was secretly sentenced to three and a half years for raising awareness of the persecution of her faith, Falun Gong."," Ngày 26 tháng 7 năm 2023, một người phụ nữ 55 tuổi ở huyện Thanh Nguyên, tỉnh Liêu Ninh đã bị đưa tới Nhà tù Đại Bắc ở Thẩm Dương, thủ phủ của tỉnh Liêu Ninh, chỉ bốn tháng sau khi bị kết án bí mật 3 năm 6 tháng tù giam vì nâng cao nhận thức về cuộc bức hại đối vớiPháp Luân Công, đức tin của bà."
"Ms. Zhang Chuanwen was arrested on December 4, 2022, with two other Falun Gong practitioners, Mr. Liu Zhenqing and Mr. Du Qinghua, after being reported for handing out calendars with information about Falun Gong.","Bà Trương Truyền Văn bị bắt cóc vào ngày 4 tháng 12 năm 2022 cùng với hai học viên Pháp Luân Công khác là ông Lưu Chấn Thanh và ông Đô Thanh Hoa, sau khi bị tố cáo phát tặng lịch năm mới có in thông tin về Pháp Luân Công."
Mr. Liu’s home was ransacked.,Nhà của ông Lưu đã bị lục soát.
"The police also attempted to ransack Ms. Zhang’s home, but she refused to take them to where she lived.",Cảnh sát cũng có ý định khám xét nhà bà Trương nhưng bà từ chối đưa họ về nhà.
"Mr. Liu and Mr. Du were both given five days of administrative detention, but the police didn’t enforce it and released them.",Ông Lưu và ông Đô đều bị phạt tạm giữ hành chính 5 ngày nhưng cảnh sát đã không thi hành và sau đó đã thả họ.
"Ms. Zhang was taken to the Qingyuan County Police Department and transferred to the Nangou Detention Center on December 9, 2022 for criminal detention.",Bà Trương bị đưa tới Phòng Cảnh sát Huyện Thanh Nguyên rồi bị giam giữ hình sự tạiTrại tạm giamNam Câu vào ngày 9 tháng 12 năm 2022.
The police later submitted her case to the Wanghua District Procuratorate.,"Sau đó, cảnh sát đã gửi vụ việc của bà tới Viện Kiểm sát Huyện Vọng Hoa."
"A detention center guard jabbed Ms. Zhang’s mouth with a mop, causing her teeth to become loose.","Trong trại tạm giam, một lính canh đã thọc cây lau nhà vào miệng bà Trương khiến hàm răng của bà lung lay."
"Her cellmates also abused her, yet the guards turned a blind eye.",Các tù nhân cùng phòng giam ngược đãi bà nhưng lính gác nhắm mắt làm ngơ.
Her lawyer learned of her abuse while visiting her and relayed her situation to her family.,"Khi đến thăm bà, luật sư của bà đã biết đến việc bà bị ngược đãi và thông báo sự việc cho gia đình bà."
The guards and cellmates stopped abusing her after her loved ones submitted a complaint letter against them to the detention center director.,Lính canh và những tù nhân cùng phòng giam đã ngừng ngược đãi sau khi người thân của bà Trương gửi đơn khiếu nại họ tới giám đốc trại giam.
She was later moved to another cell.,"Sau đó, bà được chuyển tới một buồng giam khác."
"When Ms. Zhang’s family called the prosecutor on April 10, 2023, to ask about her case, the prosecutor said he had transferred it to the court on March 1.","Ngày 10 tháng 4 năm 2023, gia đình bà Trương gọi điện cho công tố viên để hỏi về vụ việc nhưng được trả lời rằng vụ việc của bà đã được chuyển tới tòa án vào ngày 1 tháng 3."
The family then immediately called the court and was told that she had already been tried on March 24 and sentenced on April 1.,"Sau đó, gia đình ngay lập tức gọi điện tới tòa án và được biết bà Trương đã bị xét xử vào ngày 24 tháng 3 và kết án vào ngày 1 tháng 4."
The judge said he’d appointed a lawyer to represent Ms. Zhang and that the window for her to appeal the verdict was set to expire the next day (April 11).,Thẩm phán cho biết ông ta đã chỉ định một luật sư đại diện cho bà Trương và rằng thời hạn kháng cáo bản án sẽ hết hạn vào ngày hôm sau (tức ngày 11 tháng 4).
"When the family asked the judge why he failed to inform them or their own lawyer of the trial, he said it wasn’t necessary.",Khi gia đình hỏi thẩm phán tại sao ông ta không thông báo điều này cho họ hoặc luật sư thì ông ta nói rằng điều đó là không cần thiết.
"Given the family’s insistence on seeking justice for Ms. Zhang, he agreed to extend the deadline for Ms. Zhang to appeal the sentence by two days.","Trước sự kiên quyết của gia đình nhằm tìm lại công lý cho bà Trương, thẩm phán đã đồng ý kéo dài thời hạn để bà Trương kháng cáo bản án thêm hai ngày."
"Many years ago when I was distributing Falun Dafa informational material at the market, I came across a woman in her 50s, who asked if what I was handing out was about Falun Gong."," Cách đây nhiều năm khi tôi đang phát các tài liệuPháp Luân Đại Pháptại một khu chợ thì tình cờ gặp một người phụ nữ ngoài 50 tuổi, hỏi rằng những gì tôi đang phát có phải là tài liệu Pháp Luân Công hay không."
"“If it is, I want it.",“Nếu đúng thì tôi lấy.
"If not, I don’t,” she said.","Nếu không thì tôi không lấy đâu“, bà ấy nói."
I showed her that it was and she smiled as she took it.,"Tôi đưa tài liệu cho bà ấy xem, bà mỉm cười khi nhận lấy nó."
"She held my hands and said, “Falun Gong is awesome!",Bà nắm tay tôi và nói: “Pháp Luân Công thật tuyệt vời!
You guys are so great for holding on despite all this suppression and persecution!,Các vị thật kiên cường giữ vững đức tin bất chấp mọi sự đàn áp và bức hại!
Your Master is amazing.,"Sư phụ của các vị thật vĩ đại, đã dạy dỗ nhiều đệ tử xuất sắc."
He has taught so many outstanding disciples.,Các vị là hy vọng của nhân loại—con người tương lai sẽ nhớ đến các vị.
You are the hope of mankind—people will remember you in the future.,"Tôi từng có một nguyện vọng: ‘Nếu tôi có thể gặp các học viên Pháp Luân Công, tôi sẽ đưa cho họ tất cả số tiền tôi đang mang theo lúc đó để họ có thể dùng để in tài liệu và cứu người’."
"I once had a wish: ‘If I could meet Falun Gong practitioners, I would give them all the money I had with me at the time so that they could use it to print information and save people.’ I know you pay for these materials yourself.”",Tôi biết các vị tự bỏ tiền để làm ra những tài liệu này”.
"She pulled out all the money in her pocket, large and small bills, and insisted on giving them to me.","Bà ấy lấy hết tiền trong túi ra, đủ mệnh giá lớn, nhỏ và nhất quyết đưa cho tôi."
"“I can’t take your money, but I do appreciate your support and good wishes,” I said.","Tôi nói: “Tôi không thể nhận tiền của chị, tôi rất cảm kích sự ủng hộ và mong muốn tốt đẹp của chị“."
"She insisted on giving me something so, in the end, I took ten yuan and used it to buy office supplies to make more materials.","Bà ấy cứ nhất quyết phải đưa một ít cho tôi nên cuối cùng, tôi nhận 10 tệ và dùng để mua văn phòng phẩm để làm tài liệu."
I asked if anyone in her family practiced Falun Gong.,Tôi hỏi liệu có ai trong gia đình bà tu luyện Pháp Luân Công hay không.
"“No,” she said, “but I know you Falun Gong are amazing!”","Bà ấy nói: “Không, nhưng tôi biết Pháp Luân Công các vị là tốt!”"
I teared up.,Tôi rơi lệ.
What an extraordinary person!,Quả là một sinh mệnh không tầm thường!
I wished her a bright future and waved goodbye.,Tôi chúc bà có một tương lai tươi sáng và vẫy tay chào tạm biệt.
"Inearly2006,Annie (pseudonym), a Shenyang Hospital employee, revealed that the Chinese Communist Party (CCP) was authorizing the harvesting organs from Falun Gong practitioners while they were still alive."," Đầu năm 2006, cô Annie (bí danh), nhân viên Bệnh viện Thẩm Dương, tiết lộ rằng Đảng Cộng sản Trung Quốc (ĐCSTQ) đã cho phép thu hoạch nội tạng từ các học viênPháp Luân Côngkhi họ vẫn còn sống."
"Her ex-husband (a physician) had taken about 2,000 corneas from Falun Gong practitioners.",Chồng cũ của cô (một bác sỹ) đã lấy khoảng 2.000 giác mạc từ mắt của các học viên Pháp Luân Công.
"That same year, Peter (pseudonym) disclosed inside information to theEpoch Timesthat the CCP had a secret concentration camp for Falun Gong practitioners at Sujiatun in Shenyang City, Liaoning Province.","Cùng năm đó, ông Peter (bí danh) đã tiết lộ thông tin nội bộ vớiThe Epoch Timesrằng ĐCSTQ có một trại tập trung bí mật dành cho các học viên Pháp Luân Công ở Tô Gia Đồn thuộc thành phố Thẩm Dương, tỉnh Liêu Ninh."
"At the time, many people questioned this.","Tại thời điểm đó, nhiều người đã nghi vấn về điều này."
"They found it inconceivable that someone could remove kidneys, livers, and corneas from people while they were alive because it was so cruel.","Họ thấy không thể tưởng tượng được lại có người có thể lấy thận, gan và giác mạc của người còn đang sống vì như vậy quá tàn nhẫn."
"However, an increasing number of witness testimonies and independent reports began surfacing.","Tuy nhiên, số lời khai của nhân chứng và các báo cáo độc lập xuất hiện ngày càng nhiều."
"Over 2,000 voice recordings revealed that the crimes were initiated by former CCP leader Jiang Zemin.",Hơn 2.000 bản ghi âm đã tiết lộ rằng tội ác này do cựu lãnh đạo ĐCSTQ Giang Trạch Dân khởi xướng.
"Under the CCP’s directive and its military, the prisons, courts, and hospitals in China created a secret, dark organ supply chain.","Dưới sự chỉ đạo của ĐCSTQ, quân đội, nhà tù, tòa án và bệnh viện ở Trung Quốc đã tạo ra một chuỗi cung ứng nội tạng bí mật và đen tối."
"In July 2006, Canadian human rights lawyer David Matas and former Secretary of State (Asia Pacific) David Kilgour published a report revealing how Falun Gong practitioners were murdered for their organs.","Tháng 7 năm 2006, luật sư nhân quyền người Canada David Matas và nguyên Ngoại trưởng (Châu Á Thái Bình Dương), ông David Kilgour, đã công bố một báo cáo tiết lộ các học viên Pháp Luân Công đã bị sát hại để lấy nội tạng như thế nào."
"They called this a, “new form of evil on this planet.” During their investigations, Mr. Matas and Mr. Kilgour collected additional evidence, and in 2009 they publishedBloody Harvest: Organ Harvesting of Falun Gong Practitioners in China.","Họ gọi đây là “hình thức tà ác mới trên hành tinh này.” Trong quá trình điều tra, ông Matas và ông Kilgour đã thu thập thêm nhiều bằng chứng, đến năm 2009, họ đã xuất bản cuốn sách “Thu hoạch đẫm máu: Thu hoạch nội tạng từ học viên Pháp Luân Công ở Trung Quốc” (Bloody Harvest: Organ Harvesting of Falun Gong Practitioners in China)."
"The United States House of Representatives passed Resolution 343 on June 13, 2016, urging the CCP to immediately stop harvesting organs from Falun Gong practitioners and other prisoners of conscience.","Ngày 13 tháng 6 năm 2016, Hạ viện Hoa Kỳ đã thông qua Nghị quyết 343 để kêu gọi ĐCSTQ ngừng ngay việc thu hoạch nội tạng từ các học viên Pháp Luân Công và các tù nhân lương tâm khác."
"The resolution also requested a reliable, transparent, and independent investigation into this matter.","Nghị quyết cũng yêu cầu tiến hành một cuộc điều tra đáng tin cậy, minh bạch và độc lập về vấn đề này."
