"The arresting officers from the Hebei Police Station and the Bajiazi Town Domestic Security Office released her the next day, but took her back into custody on August 31.","Những người bắt giữ bà là cảnh sát từ Đồn Công an Hà Bắc và Đội An ninh Nội địa thị trấn Bát Gia Tử Họ đã thả bà vào ngày hôm sau, nhưng lại bắt bà trở lại vào ngày 31 tháng 8."
Ms. Sun was initially held at the Dunhua City Detention Center before being transferred to the Yanji City Detention Center.,"Ban đầu bà Tôn ban đầu bị giam ở trong Trại tạm giam thành phố Đôn Hóa, sau đó bị chuyển đến Trại tạm giam thành phố Diên Cát."
"The Longjing CityProcuratorateindicted Ms. Sun, and the Longjing City Court sentenced her.",Viện kiểm sát thành phố Long Tỉnh đã truy tố bà Tôn và Tòa án thành phố Long Tỉnh đã kết án bà.
Both Longjing City and Helong City are under the administration of Yanbian Korean Autonomous Prefecture in Jilin Province.,(Cả thành phố Long Tỉnh và thành phố Hòa Long đều nằm dưới sự quản lý của khu tự trị Triều Tiên Diên Biên ở tỉnh Cát Lâm).
"Ms. Sun is currently held in the city of Changchun, but her exact whereabouts are unknown.",Bà Tôn hiện đang bị giam ở thành phố Trường Xuân (chưa rõ địa điểm chính xác).
This is not the first time that Ms. Sun has been targeted for her faith.,Đây không phải lần đầu tiên bà Tôn bị chính quyền nhắm đến vì kiên định đức tin của mình.
"During the past 24 years, both she and her family have suffered tremendously at the hands of the communist regime.","Trong 24 năm qua, cả bà và gia đình đều phải chịu nhiều thống khổ dưới bàn tay của chính quyền cộng sản."
Her son was still a little boy when her first four arrests took place.,"Trong bốn vụ bắt giữ đầu tiên của bà, con trai bà vẫn còn là một cậu bé."
"The police even held the boy, then a third-grader, as a hostage in 2013 in an attempt to force her to renounce Falun Gong.",Cảnh sát thậm chí còn bắt giữ cả cậu bé để làm con tin vào năm 2013 (khi đó là học sinh lớp 3) nhằm ép bà từ bỏ Pháp Luân Công.
Her daughter was so traumatized that she developed numerous illnesses over the years.,Con gái bà bị tổn thương nặng nề đến mức mắc nhiều bệnh tật trong nhiều năm.
Ms. Sun’s husband divorced her under pressure.,Chồng bà Tôn vì quá áp lực nên đã ly hôn bà.
"They remarried six years later, only to divorce again under the relenting pressure.","Sáu năm sau họ tái hôn, nhưng rồi lại ly hôn một lần nữa do áp lực triền miên từ cuộc bức hại."
"Falun Gong practitioners hosted the “Stop the CCP’s Live Organ Harvesting Poster Exhibition” at the Asaka City Industrial Culture Center in Saitama Prefecture from September 29 to October 1, 2023."," Các học viênPháp Luân Côngđã tổ chức “Triển lãm áp phích chấm dứt nạn thu hoạch nội tạng sống của ĐCSTQ” tại Trung tâm Văn hóa Công nghiệp Thành phố Asaka, tỉnh Saitama từ ngày 29 tháng 9 đến ngày 1 tháng 10 năm 2023."
"On the last day of the exhibition, the organizers screened “Human Harvest,” a documentary about the state-sanctioned human organ harvesting from living practitioners, including the active transplant chain in China.","Vào ngày cuối cùng của triển lãm, ban tổ chức đã trình chiếu bộ phim “Thu hoạch nhân thể” (Human Harvest), một bộ phim tài liệu về nạn thu hoạch nội tạng người từ các học viên còn sống do chính phủ hậu thuẫn, bao gồm toàn chuỗi cấy ghép tạng đang diễn ra ở Trung Quốc."
"After seeing the poster exhibition and the documentary, people in the audience said they had a deeper understanding of the Chinese Communist Party’s (CCP) willingness to commit atrocities and wanted more information about Falun Gong.","Sau khi xem triển lãm áp phích và phim tài liệu, khán giả cho biết họ đã hiểu sâu hơn về việc Đảng Cộng sản Trung Quốc (ĐCSTQ) sẵn sàng thực hiện các tội ác tàn bạo và muốn biết thêm thông tin về Pháp Luân Công."
The “Stop the CCP’s Live Organ Harvesting Poster Exhibition” was held at the Asaka City Industrial Culture Center from September 29 to October 1.,“Triển lãm áp phích chấm dứt nạn thu hoạch nội tạng sống của ĐCSTQ” được tổ chức tại Trung tâm Văn hóa Công nghiệp Thành phố Asaka từ ngày 29 tháng 9 đến ngày 1 tháng 10.
"Screening “Human Harvest,” a documentary about the state-sanctioned human organ harvesting from living practitioners in China","Chiếu phim “Thu hoạch nhân thể”, một bộ phim tài liệu về nạn thu hoạch nội tạng người do nhà nước hậu thuẫn từ các học viên còn sống ở Trung Quốc"
Viewers Shocked at the CCP’s Atrocities,Người xem bị sốc trước sự tàn bạo của ĐCSTQ
"In addition to the posters, in a separate room, visitors could watch videos detailing human organ harvesting crimes from living practitioners in China.","Ngoài các tấm áp phích, trong một căn phòng riêng biệt, khách tham quan có thể xem các video trình bày chi tiết về tội ác thu hoạch nội tạng người từ các học viên còn sống ở Trung Quốc."
"People’s expressions turned solemn after learning the facts, and some were even moved to tears, stunned that such cruelty can still occur in this day and age.","Sau khi biết sự thật, vẻ mặt của mọi người trở nên nghiêm nghị, một số thậm chí rơi lệ, choáng váng vì sự tàn ác như vậy vẫn có thể xảy ra trong thời đại ngày nay."
A commentator told her that people could talk to their legislative representatives to pass a law to stop the crime and that some local councils had passed resolutions that they submitted to Congress.,"Một người bình luận nói với cô rằng mọi người có thể trao đổi với các đại diện lập pháp của họ để thông qua luật nhằm chấm dứt tội ác này, hiện một số hội đồng địa phương đã thông qua các nghị quyết và đệ trình lên Quốc hội."
The woman said she would share the information with her friends and would bring them when the event returns.,Người phụ nữ cho hay cô sẽ chia sẻ thông tin này với bạn bè và sẽ mời họ đến dự sự kiện lần tới.
A teenage girl said that this was the first time she’d heard about organ harvesting from the living.,Một cô gái tuổi teen cho biết đây là lần đầu tiên cô nghe nói đến nạn thu hoạch nội tạng từ người sống.
"“It’s very sad that so many people have had their organs harvested while they were still alive.” She wanted to do something to help, so she said that she would tell her friends.",“Thật đau lòng khi có rất nhiều người đã bị thu hoạch nội tạng trong khi họ vẫn còn sống.” Cô muốn làm gì đó trong khả năng của mình để giúp đỡ nên cô nói cô sẽ kể lại cho bạn bè.
She also took photos to share online.,Cô còn chụp ảnh để chia sẻ lên mạng xã hội.
A man came to see the poster exhibition with his high school daughter.,Một người đàn ông đến xem triển lãm áp phích cùng cô con gái đang ở độ tuổi trung học.
"“I saw the flier that said, ‘Silence means siding with the persecutors’ and felt that I had to come and learn the truth.” He also said that he would bring his friends when the event returns.",“Tôi nhìn thấy tờ rơi có đoạn viết: ‘Im lặng có nghĩa là đứng về phía những kẻ bức hại’ và cảm thấy tôi phải đến và tìm hiểu sự thật.” Anh còn cho biết anh sẽ mời bạn bè cùng đi khi triển lãm quay trở lại.
"A man in his 50s said, “Thank you very much for giving me the opportunity to learn the facts.",Một người đàn ông khoảng 50 tuổi nói: “Cảm ơn rất nhiều vì đã cho tôi cơ hội tìm hiểu sự thật.
I didn’t know that the CCP was responsible for such evil.,Tôi đã không biết rằng ĐCSTQ đã gây ra tội ác như vậy.
I don’t think Taiwan should become part of China.,Tôi không nghĩ Đài Loan nên trở thành một phần của Trung Quốc.
I will tell others I know what I saw today.”,Tôi sẽ nói cho những người khác biết về những gì tôi đã thấy ngày hôm nay.”
Screening the Documentary “Human Harvest”,Chiếu phim tài liệu “Thu hoạch nhân thể”
"Some said that they knew that the CCP regime was a dictatorship, but they never realized that it was so evil.","Một số người cho hay họ biết chế độ ĐCSTQ là một chế độ độc tài, nhưng họ không thể ngờ rằng nó tà ác đến thế."
"“Harvesting organs from living people and selling them for profit is not human behavior,” someone remarked.",Có người nhận xét: “Thu hoạch nội tạng từ người sống rồi bán chúng để kiếm lời không phải là hành vi của con người”.
"Some viewers said that they already thought that the CCP was bad, but now they had a deeper understanding of just how bad.","Một số khán giả nói rằng họ từ lâu đã nghĩ ĐCSTQ tệ hại, nhưng bây giờ họ hiểu sâu hơn về việc nó tệ đến mức nào."
"“I hope those Japanese politicians who are pro-China can clearly see just how evil the CCP is,” one said.",Một người cho biết: “Tôi hy vọng các chính trị gia Nhật Bản thân Trung Quốc có thể thấy rõ sự tà ác của ĐCSTQ”.
"When viewers raised questions, such as, “Why does the CCP suppress Falun Gong?” and “Why do Falun Gong practitioners refuse to give up their faith despite such a severe suppression?” the practitioners were able to provide in-depth, thoughtful answers.",Khi người xem đặt ra những câu hỏi như “Tại sao ĐCSTQ lại đàn áp Pháp Luân Công?” và “Tại sao các học viên Pháp Luân Công vẫn không chịu từ bỏ đức tin của mình mặc dù bị đàn áp nghiêm trọng như vậy?” các học viên đã có thể đưa ra những câu trả lời sâu sắc và thấu đáo.
Some people said that they wanted to learn the Falun Gong exercises.,Một số người cho hay họ muốn học các bài công pháp của Pháp Luân Công.
"A Qingdao City, Shandong Province, resident stood trial on October 12, 2023 for her faith in Falun Gong, a mind-body practice that has been persecuted by the Chinese Communist Party since July 1999."," Một cư dân thành phố Thanh Đảo, tỉnh Sơn Đông bị đưa ra xét xử vào ngày 12 tháng 10 năm 2023 chỉ vì đức tin vàoPháp Luân Công, một môn tu luyện cả tâm và thân bị ĐCSTQ bức hại từ tháng 7 năm 1999."
"Ms. Wei Chunrong, a native of Huanan County, Heilongjiang Province, has been living with her son’s family in Qingdao City since 2013.","Bà Ngụy Xuân Vinh, một cư dân huyện Hoa Nam, tỉnh Hắc Long Giang, sống cùng gia đình con trai bà ở thành phố Thanh Đảo từ năm 2023."
"She was most recently arrested on March 2, 2023, after a man reported her for talking to him about Falun Gong.","Lần gần đây nhất, vào ngày 2 tháng 3 năm 2023, bà bị bắt sau khi một người đàn ông tố giác bà với chính quyền chỉ vì bà giảng chân tướng về Pháp Luân Công cho anh ta."
The arresting officers from the Zhengyang Road Police Station raided her son’s home and confiscated her five memory cards and three music players.,Người của Đồn công an đường Chính Dương đã bắt giữ bà Ngụy tại nhà con trai bà và tịch thu năm cái thẻ nhớ cùng ba chiếc máy nghe nhạc của bà.
The police accused Ms. Wei of organizing people to promote Falun Gong and took her to the Jimo District Second Detention Center in Qingdao City.,Cảnh sát buộc tội bà Ngụy tổ chức nhóm truyền bá Pháp Luân Công và đưa bà tớiTrại tạm giamsố 2 huyện Tức Mặc ở thành phố Thanh Đảo.
"On June 6, 2023, the police submitted Ms. Wei’s case to the Jimo DistrictProcuratorate, which indicted her on July 5.","Ngày 6 tháng 6 năm 2023, cảnh sát đã chuyển vụ việc của bà Ngụy tới Viện kiểm sát huyện Tức Mặc, cơ quan này đã truy tố bà vào ngày 5 tháng 7."
The Jimo District Court held a hearing of her case at the detention center on October 12.,Tòa án huyện Tức Mặc đã mở phiên tòa xét xử bà tại trại tạm giam vào ngày 12 tháng 10.
This is not the first time that Ms. Wei has been targeted by the police in Qingdao City.,Đây không phải lần đầu tiên bà Ngụy bị cảnh sát thành phố Thanh Đảo nhắm đến vì đức tin của mình.
She was arrested by the Chengyang District Domestic Security Office in August 2023 and detained for ten days.,"Tháng 8 năm 2023, bà bị Phòng An ninh Nội địa huyện Thành Dương bắt và giam giữ trong 10 ngày."
The seven practitioners included six Beijing residents and one resident of nearby Hebei Province.,7 học viên này gồm có 6 cư dân Bắc Kinh và 1 cư dân tỉnh Hà Bắc lân cận.
They were arrested between March and July 2022 and all were indicted by the Shunyi DistrictProcuratorate.,Họ bị bắt trong khoảng thời gian từ tháng 3 đến tháng 7 năm 2022 và tất cả đều bị Viện Kiểm sát quận Thuận Nghĩa truy tố.
"Mr. Tan Shouli was sentenced to 7 years, Ms. Hu Jinfeng and Ms. Chen Yuying were each sentenced to 4 years, Ms. Wang Runrong was senetenced to 3.5 years, Ms. An Xiurong was sentenced to 2 years, and Mr. Wu Zhiming was sentenced to 1.5 years.","Ông Đàm Thủ Lễ bị kết án 7 năm tù, bà Hồ Cẩm Phượng và bà Trần Ngọc Anh mỗi người bị kết án 4 năm tù, bà Vương Nhuận Vinh bị kết án 3,5 năm tù, bà An Tú Vinh bị kết án 2 năm tù và ông Ngô Chí Minh bị kết án 1,5 năm tù."
It is unclear whether Mr. Zhao Ping was sentenced.,Hiện chưa rõ ông Triệu Bình có bị kết án hay không.
"Ms. Hu, 43, lives in Dingxing County, Hebei Province.","Bà Hồ (43 tuổi) sinh sống ở huyện Định Hưng, tỉnh Hà Bắc."
"She was arrested in Shunyi District on July 27, 2022.",Bà bị bắt giữ tại quận Thuận Nghĩa vào ngày 27 tháng 7 năm 2022.
"She was also taken to the Shunyi District Detention Center, where she was interrogated for eight straight days with her hands cuffed behind her back.",Bà cũng bị giam trong trại tạm giam quận Thuận Nghĩa và bà bị thẩm vấn trong 8 ngày liên tục với hai tay bị còng ra sau lưng.
"A formal arrest warrant was issued against her on November 2, 2022.",Bà bị bắt giữ chính thức vào ngày 2 tháng 11 năm 2022.
"Mr. Wu, Ms. Chen, Ms. An, and Mr. Zhao were all arrested in late July 2022, although the exact dates are not known.","Ông Ngô, bà Trần, bà An và ông Triệu đều bị bắt vào cuối tháng 7 năm 2022 (chưa xác định được ngày cụ thể)."
They were taken to the Shunyi District Detention Center and subjected to marathon interrogations like Ms. Hu.,Họ bị đưa đến trại tạm giam quận Thuận Nghĩa và bị thẩm vấn liên tục giống như bà Hồ.
"During the seven practitioners’ hearings at the Shunyi District Court on April 27, 2023, their lawyers entered a not guilty plea for them and demanded their acquittal.","Trong phiên tòa xét xử 7 học viên vào ngày 27 tháng 4 năm 2023, luật sư của các học viên đưa ra lời bào chữa vô tội cho họ và yêu cầu xử trắng án cho thân chủ của họ."
The presiding judge held a virtual sentencing hearing on September 17 without informing their families.,"Ngày 17 tháng 9, chủ tọa phiên tòa mở phiên tòa tuyên án trực tuyến mà không thông báo cho người nhà của các học viên."
Only the lawyers were notified.,Tòa án chỉ thông báo cho các luật sư về phiên xét xử.
"After the Chinese Communist Party ordered the persecution of Falun Gong in 1999, practitioners all over the country went to Beijing to appeal, only to be arrested and sent to labor camps, detention centers, and prisons."," Sau khi Đảng Cộng sản Trung Quốc (ĐCSTQ) ra lệnh đàn áp Pháp Luân Công vào năm 1999, các học viên trên cả nước đã đến Bắc Kinh đểthỉnh nguyện, nhưng lại bị bắt và đưa đến các trại lao động,trại tạm giamvà nhà tù."
My husband hired a lawyer to prepare a lawsuit and submitted it to the court.,Chồng tôi đã thuê luật sư chuẩn bị hồ sơ và nộp ra tòa.
"Due to pressure from the authorities, the court didn’t dare to accept the case and we had to give up.","Trước sức ép của cơ quan chức năng, tòa án không dám thụ lý vụ án và chúng tôi đành bỏ cuộc."
"When the persecution was so severe, it was a courageous act for my husband to speak up for Falun Gong.","Khi cuộc bức hại quá nghiêm trọng, việc chồng tôi lên tiếng ủng hộ Pháp Luân Công là một hành động dũng cảm."
"Because of his kindness, he was blessed during a car accident a few months later.","Vì lòng tốt của mình, anh ấy đã được ban phước trong một vụ tai nạn xe hơi vài tháng sau đó."
My husband was driving out of town for a business trip.,Chồng tôi đang lái xe ra khỏi thành phố để đi công tác.
"On the highway, he lost control of the car, and it went under a large truck.","Trên đường cao tốc, anh ấy bị mất lái và lao vào gầm một chiếc xe tải lớn."
"The windshield was shattered, and the car was severely damaged, but the four of them in the car were not harmed at all.","Kính chắn gió vỡ tan, chiếc xe bị hư hỏng nặng nhưng 4 người trong xe không hề hấn gì."
"During the crash the person sitting behind my husband was pushed into his back, where he had a herniated disc.","Trong lúc va chạm, người ngồi sau chồng tôi đã bị ép vào lưng anh ấy, nơi đó anh bị thoát vị đĩa đệm."
The force of the impact somehow rectified his condition.,Lực tác động bằng cách nào đó đã khắc phục được tình trạng của anh ấy.
He no longer had back pain after the accident.,Anh không còn bị đau lưng sau vụ tai nạn.
How amazing is that!,Điều đó thật tuyệt vời làm sao!
"In another incident, when he was walking on the street, a car drove towards him at a high speed.","Trong một lần khác, khi anh đang đi bộ trên đường, một chiếc ô tô chạy với tốc độ cao về phía anh."
He did not have time to avoid it and was hit.,Anh chưa kịp né tránh đã bị đâm phải.
"Instead of being knocked to the ground, he ended up on the roof of the car, unharmed!","Thay vì bị hất xuống đất, anh ấy lại nằm trên nóc xe mà không hề hấn gì!"
There was a time when my husband drove a truck to another city.,Có lần chồng tôi lái xe tải đi thành phố khác.
The brakes suddenly stopped working when the vehicle was headed downhill!,Phanh đột ngột ngừng hoạt động khi xe đang xuống dốc!
"It went downhill at high speed, and his companion was extremely scared.","Nó lao xuống dốc với tốc độ cao, khiến người bạn đồng hành của anh ấy vô cùng sợ hãi."
"My husband held the wheel firmly, the truck slowed down gradually, and there was no accident.","Chồng tôi giữ vững tay lái, xe tải giảm tốc độ dần dần và không xảy ra tai nạn."
"Falun Dafa practitioners have been persevering in bringing the truth about Dafa to the public for years, which helped many people understand the facts and support the practice."," Các học viên Pháp Luân Đại Pháp đã kiên trì đưa chân tướng về Đại Pháp ra công chúng trong nhiều năm, điều này đã giúp nhiều người hiểu được chân tướng và ủng hộ pháp môn tu luyện."
Below are two such stories.,Dưới đây là hai câu chuyện như vậy.
“Falun Dafa Is Indeed Good!”,“Pháp Luân Đại Pháp thật sự tốt!”
"At a town fair, an elderly man was selling some delightful goodies.","Tại một hội chợ thị trấn, một cụ ông đang bán một số món quà thú vị."
"When he saw me, he kindly greeted me and began to chat.","Khi nhìn thấy tôi, ông ấy vui vẻ chào tôi và bắt đầu trò chuyện."
I took this opportunity toclarify the factsabout Falun Dafa to him.,Tôi nhân cơ hội này để giảng chân tướng về Pháp Luân Đại Pháp cho ông ấy.
"To my delight, he said he had heard about Falun Dafa from a woman at the market.",Tôi rất vui mừng khi ông ấy nói rằng đã nghe nói đến Pháp Luân Đại Pháp từ một người phụ nữ ở chợ.
She had helped him quit the Chinese Communist Party (CCP) and its related organizations.,Bà ấy đã giúp ông thoái Đảng Cộng sản Trung Quốc (ĐCSTQ) và các tổ chức liên quan của nó.
He asked me if I also practice Falun Dafa.,Ông ấy hỏi có phải tôi cũng tu luyện Pháp Luân Đại Pháp không.
"I responded, “Yes, I do!",Tôi đáp: “Có chứ!
"I used to have all sorts of illnesses, but I am illness free now!”","Trước đây cháu mắc đủ loại bệnh tật, nhưng bây giờ cháu đã khỏi bệnh!”"
“I can see that Falun Dafa is indeed good!,“Ta có thể thấy rằng Pháp Luân Đại Pháp thực sự tốt!
"See, I have this [Falun Dafa] brochure and I like reading it a lot!","Nhìn này, ta có cuốn tài liệu [Pháp Luân Đại Pháp] này và ta rất thích đọc nó!"
Do you have any more?” I gave him some other materials and he thanked me profusely.,Cậu còn cái nào nữa không?” Tôi đưa cho ông ấy một số tài liệu khác và ông cảm ơn tôi rất nhiều.
He began reading immediately!,Ông ấy bắt đầu đọc ngay lập tức!
Reading “Falun Dafa Is Good!” to the Marketplace Crowd,Đọc “Pháp Luân Đại Pháp hảo!” cho đám đông ở chợ
"At the market, I met a farmer who was warm, cheerful, and talkative.","Ở chợ, tôi gặp một người nông dân nhiệt tình, vui vẻ và hay nói."
I told him that he looked great and guessed he was in his 60s.,Tôi nói với ông ấy rằng ông ấy trông rất tuyệt và đoán rằng ông đã ngoài 60 tuổi.
He responded that he was actually 75 years old.,Ông trả lời rằng thực tế ông đã 75 tuổi.
"I remarked, “Wow, you are blessed.","Tôi nhận xét: “Chà, cụ thật may mắn."
You look healthy and energetic!”,Cụ trông khỏe mạnh và tràn đầy năng lượng!”
"The elderly farmer accepted the card and read it out loud in front of the crowd at the marketplace, “Falun Dafa is good, Truthfulness-Compassion-Forbearance is good!”","Cụ nông dân lớn tuổi đó đã nhận tấm thẻ và đọc to trước đám đông ở chợ: “Pháp Luân Đại Pháp hảo, Chân-Thiện-Nhẫn hảo!”"
I then told him more about Falun Dafa and persuaded him to quit the CCP and its related organizations.,Sau đó tôi nói với ông ấy nhiều hơn về Pháp Luân Đại Pháp và thuyết phục ông ấy thoái xuất khỏi ĐCSTQ và các tổ chức liên quan của nó.
"Ms. Li Shunhua, 83, from Maoming City, Guangdong Province was transferred to the Guangdong Province Women’s Prison on September 12, 2023 to serve time for her faith in Falun Gong, a spiritual discipline that has been persecuted by the Chinese communist regime since 1999."," Ngày 12 tháng 9 năm 2023, bà Lý Thuận Hoa (83 tuổi) ở thành phố Mậu Danh, tỉnh Quảng Đông đã bị chuyển đến Nhà tù Nữ tỉnh Quảng Đông để chấp hành án tù oan sai vì tu luyệnPháp Luân Công, một pháp môn tu luyện bị chính quyền cộng sản Trung Quốc bức hại từ năm 1999."
"Ms. Li Shunhua was sentenced to one year and fined 3,000 yuan on February 28, 2023.",Trước đó bà Lý Thuận Hoa đã bị kết án 1 năm tù và phạt tiền 3.000 Nhân dân tệ vào ngày 28 tháng 2 năm 2023.
"She had been out on bail following her arrest on October 23, 2020, but was taken back into custody after her sentencing hearing on February 28, 2023.","Bà đã được bảo lãnh tại ngoại sau vụ bắt giữ ngày 23 tháng 10 năm 2020, nhưng bị tạm giam sau khi bị tuyên án vào ngày 28 tháng 2 năm 2023."
She filed an appeal while being held at the Maoming City No. 1 Detention Center.,"Khi ở trongTrại tạm giamSố 1 thành phố Mậu Danh, bà đã nộp đơn kháng cáo."
"Judges Zhang Chi, Li Jinjie and Liang Dongqing of the Maoming City Intermediate Court ruled on June 5, 2023, to uphold her prison sentence, which began on February 28, 2023.","Các thẩm phán Trương Thỉ, Lý Cẩm Kiệt và Lương Đông Thanh của Tòa án Trung cấp thành phố Mậu Danh đã ra phán quyết giữ nguyên bản án tù của bà, và thời gian chấp hành án được tính từ ngày 28 tháng 2 năm 2023."
