"Two residents of Yilan County, Heilongjiang Province were sentenced to prison and given heavy fines on June 7, 2023 for their faith in Falun Gong, a spiritual discipline that has been persecuted by the Chinese communist regime since 1999."," Ngày 7 tháng 6 năm 2023, hai công dân huyện Y Lan, tỉnh Hắc Long Giang đã bị kết án tù và bị phạt nặng vì đức tin của họ vàoPháp Luân Công, một môn tu luyện tinh thần bị Đảng Cộng sản Trung Quốc (ĐCSTQ) bức hại từ năm 1999."
"Mr. Bai Hongyou was sentenced to six years and three months and fined 100,000 yuan.",Ông Bạch Hồng Hữu bị kết án 6 năm 3 tháng tù và bị phạt 100.000 Nhân dân tệ.
"Mr. Zhu Deshan, a 56-year-old former teacher, received two years and ten months and was fined 50,000 yuan.","Ông Chu Đắc Sơn, cựu giáo viên 56 tuổi, bị kết án 2 năm 10 tháng tù và bị phạt 50.000 Nhân dân tệ."
Arrests,Bị bắt cóc
"Officers from the Yilan County Domestic Security Office, Dongcheng Police Station, and Guanyue Police Station came to Mr. Zhu’s home at 7 a.m. on October 23, 2022.","Nhân viên Phòng An ninh Nội địa Huyện Y Lan, Đồn Cảnh sát Đông Thành, và Đồn Cảnh sát Quan Việt đã đến nhà ông Chu vào lúc 7 giờ sáng ngày 23 tháng 10 năm 2022."
They deceived his wife into opening the door by claiming to be representatives from the power company.,Họ đã lừa vợ ông mở cửa bằng cách tự xưng là người của công ty điện lực.
"Two officers restrained his wife, while the others ransacked their home.","Hai cảnh sát đã khống chế vợ ông, trong lúc các cảnh sát khác lục soát nhà của họ."
When they were done the police went to Mr. Zhu’s workplace and arrested him.,"Khi lục soát xong căn nhà, cảnh sát đã đến chỗ làm của ông Chu và bắt giữ ông."
The same group of officers next went to Mr. Bai’s home.,"Tiếp theo, nhóm cảnh sát đó đã đến nhà ông Bạch."
He lived by himself and did odd jobs to make a living.,Ông Bạch sống một mình và làm các công việc vặt để kiếm sống.
"While the police were ransacking his home, his sister came from the countryside to bring him some vegetables.","Khi cảnh sát đến lục soát nhà ông, cũng là lúc người chị gái của ông ở quê lên mang cho ông ít rau củ."
"She was terrified when she saw the police, dropped the vegetables, and quickly left.","Khi trông thấy cảnh sát, bà đã hoảng sợ đến mức đánh rơi đống rau củ và bỏ chạy."
"Both Mr. Zhu and Mr. Bai were taken to the Yilan County Detention Center, where they still remain.","Cả ông Chu và ông Bạch đều bị đưa đếntrại tạm giamHuyện Y Lan, và hiện vẫn bị giam giữ ở đấy."
"Mr. Zhu’s wife repeatedly went to the Yilan County Domestic Security Office, seeking his release.",Vợ ông Chu liên tục đến Phòng An ninh Nội địa Huyện Y Lan để yêu cầu trả tự do cho ông.
The director rejected her request with the excuse that Mr. Zhu had not renounced Falun Gong.,Trưởng phòng đã từ chối yêu cầu của bà với lý do ông Chu không chịu từ bỏ Pháp Luân Công.
First Hearing Halted After Mr. Zhu Has Medical Episode,Phiên xét xử đầu tiên bị tạm dừng sau khi ông Chu phát bệnh
"Mr. Zhu and Mr. Bai were brought to the Yilan County Court on May 8, 2023.","Ngày 8 tháng 5 năm 2023, ông Chu và ông Bạch bị đưa đến Toà án Huyện Y Lan."
Mr. Zhu was emaciated after being detained for more than six months.,Ông Chu trở nên hốc hác sau khi bị giam giữ hơn 6 tháng.
It took tremendous effort for him to just walk to his seat.,Ông rất nỗ lực mới có thể đi đến được chỗ ngồi.
He was pale and had difficulty breathing.,Ông trông nhợt nhạt và hô hấp khó khăn.
"As he stood in front of his seat, he closed his eyes, and his body began to twitch.","Khi đứng trước ghế của mình, ông nhắm mắt và cơ thể bắt đầu co giật."
He wept and shouted.,Ông khóc và hét lên.
Two bailiffs hurried over and caught him as he collapsed.,Hai viên chức vội vã chạy đến và đỡ lấy ông khi ông ngã xuống.
"After Mr. Zhu was taken to the county hospital for resuscitation, the judge adjourned the hearing.","Sau đó, ông Chu được đưa đến bệnh viện huyện để hồi sức, thẩm phán đã hoãn lại phiên tòa."
Mr. Zhu’s wife said that she was very concerned about his health.,Vợ ông Chu nói bà rất lo lắng về sức khoẻ của chồng mình.
"She recalled that one month after he started to practice Falun Gong in October 1996, his severe heart condition, gastritis, and rheumatism that had bothered him since middle school, all disappeared.","Bà nhớ lại vào tháng 10 năm 1996, một tháng sau khi ông bắt đầu luyện Pháp Luân Công, bệnh tim, viêm dạ dày và viêm thấp khớp đã làm phiền ông từ khi học cấp hai đến thời điểm đó đều đã biến mất."
"He has been very healthy for the past two decades, but developed an unknown medical condition after being incarcerated for just six months.","Ông sống rất khoẻ mạnh trong hai thập kỷ qua, nhưng lại có biểu hiện bệnh lý không rõ chỉ sau 6 tháng bị giam giữ."
Second Hearing Suddenly Changed from In-person to Virtual,Phiên xét xử thứ hai đột ngột thay đổi từ trực tiếp sang trực tuyến
"The court held a second hearing on May 25, 2023.",Phiên xét xử thứ hai diễn ra vào ngày 25 tháng 5 năm 2023.
"Six of Mr. Bai’s and Mr. Zhu’s family members came to attend the trial, but clerk Tang Zihe refused to let them all in.","Sáu thành viên gia đình của ông Bạch và ông Chu đã đến tham dự phiên xét xử, nhưng thư ký Thang Tử Hách đã từ chối không cho tất cả họ vào."
He said only two family members of each practitioner were allowed inside the courtroom.,Ông ta nói chỉ hai thân nhân của mỗi người được phép vào phòng xử án.
"After the two practitioners’ lawyers and family members finally sat down for the hearing, they noticed that Mr. Zhu and Mr. Bai were not there.","Sau khi luật sư và các thân nhân của hai học viên đã ổn định chỗ ngồi, họ nhận ra ông Chu và ông Bạch không có mặt ở đó."
"The judge announced that the originally scheduled in-person session would now be held remotely, with Mr. Zhu and Mr. Bai joining from the detention center.","Thẩm phán thông báo rằng phiên toà trực tiếp theo lịch trình ban đầu giờ đây sẽ được tổ chức từ xa, với ông Chu và ông Bạch sẽ tham gia phiên tòa từ trại tạm giam."
He said that Mr. Zhu was still in poor health.,Ông cho biết sức khỏe ông Chu vẫn chưa tốt.
Both practitioners’ lawyers and family members objected to the judge’s sudden change without any advance notice.,Luật sư và thân nhân của cả hai người đều phản đối việc thay đổi đột ngột mà không được báo trước của thẩm phán.
They requested that Mr. Zhu and Mr. Bai be brought to the courtroom for an in-person hearing or that the hearing be postponed to a later date when Mr. Zhu got better.,Họ yêu cầu ông Chu và ông Bạch phải được đưa đến phòng xử án để trực tiếp tham dự phiên xét xử hoặc tòa hoãn lại cho đến khi sức khoẻ ông Chu tốt hơn.
The judge refused their request and said that if the lawyers left the courtroom he had his own court-appointed lawyers on standby to represent the practitioners.,"Thẩm phán đã từ chối yêu cầu của họ và nói rằng nếu các luật sư rời khỏi phòng xử án, ông ta sẽ có luật sư do tòa chỉ định để đại diện cho hai học viên."
The lawyers had no choice but to agree to the virtual hearing.,Các luật sư không có lựa chọn nào khác ngoài việc đồng ý với phiên xét xử trực tuyến.
Mr. Bai and Mr. Zhu were then connected remotely to the courtroom.,Ông Bạch và ông Chu sau đó được kết nối từ xa với phòng xử án.
They both said they objected to the virtual hearing.,Cả hai đều cho biết họ phản đối phiên tòa trực tuyến này.
The judge ordered the hearing to keep going.,Thẩm phán ra lệnh tiếp tục phiên xét xử.
"Prosecutor Zhao Changpu who charged Mr. Bai and Mr. Zhu was not present, neither in person nor virtually.","Công tố viên Thiệu Trường Phổ, người tố cáo ông Bạch và ông Chu không có mặt cả trực tiếp lẫn qua mạng."
The judge did not conduct any cross-examination of the prosecution evidence as required by law.,Thẩm phán đã không tiến hành bất kỳ cuộc đối chiếu nào đối với các bằng chứng truy tố theo yêu cầu của pháp luật.
He instead kept interrupting the practitioners and their lawyers while they presented their defense statements.,"Thay vào đó, ông ta liên tục làm gián đoạn các học viên và luật sư của họ trong khi họ trình bày lời bào chữa của mình."
Appealing Wrongful Convictions,Kháng cáo bản án oan
"Mr. Zhu and Mr. Bai were both sentenced with heavy fines on June 7, 2023.","Vào ngày 7 tháng 6 năm 2023, ông Chu và ông Bạch đều bị kết án với mức phạt nặng."
They are now appealing their wrongful convictions.,Hiện họ đang kháng cáo bản án bất công của mình.
Judge Li Chenglin of the Harbin City Intermediate Court has been assigned to the appeals cases.,Thẩm phán Lý Thành Lâm của Toà án Trung cấp Thành phố Cáp Nhĩ Tân đã được chỉ định phụ trách các vụ kháng cáo.
His assistant is Mu Wanchen.,Trợ lý của ông ta là Mạc Uyển Thần.
"A 55-year-old Changchun City, Jilin Province resident was taken to the Jilin Province Women’s Prison on August 11, 2023 to serve a 1.5-year term for her faith in Falun Gong, a spiritual discipline that has been persecuted by the Chinese Communist Party since 1999."," Một cư dân 55 tuổi ở thành phố Trường Xuân, tỉnh Cát Lâm đã bị đưa vào Nhà tù Nữ Tỉnh Cát Lâm vào ngày 11 tháng 8 năm 2023 để thụ án tù 1,5 năm chỉ vì đức tin của mình vàoPháp Luân Công, một môn tu luyện tinh thần bị ĐCSTQ bức hại từ năm 1999."
"As soon as Ms. Yang Yunjie stepped out of her home on June 13, 2022, she was arrested by five plainclothes police officers waiting outside.","Ngay khi bà Dương Vân Kiệt bước ra khỏi nhà vào ngày 13 tháng 6 năm 2022, bà đã bị bắt giữ bởi năm cảnh sát mặc thường phục trực sẵn ở bên ngoài."
"The police had also removed the license plate from their car, in order not to reveal their identities.",Cảnh sát đã tháo biển số xe của mình để tránh bị lộ danh tính.
"Without showing their IDs or a search warrant, they broke into her home and confiscated her Falun Gong books.","Không hề xuất trình giấy tờ tùy thân hay lệnh khám xét, họ đột nhập vào nhà bà và tịch thu các sách Pháp Luân Công của bà."
Ms. Yang later confirmed that the officers were from the Chongqinglu Police Station.,"Bà Dương sau đó xác nhận rằng, các cảnh sát đó là người của Đồn Công an Trùng Khánh Lộ."
"During the two days she was held there, the police didn’t inform her family of her whereabouts.","Trong hai ngày bà bị giam giữ ở đó, cảnh sát không hề báo cho gia đình bà."
Her loved ones only found out about her whereabouts after reporting her disappearance.,Thân nhân của bà chỉ biết tình huống của bà sau khi đi loan báo rằng bà bị mất tích.
Ms. Yang was released at around 3 p.m. on June 15.,Bà Dương được thả vào khoảng 3 giờ chiều ngày 15 tháng 6.
"The police arrested Ms. Yang again on July 4, 2022, and took her to the Changchun City No. 4 Detention Center.",Cảnh sát một lần nữa bắt bà Dương vào ngày 4 tháng 7 năm 2022 và đưa bà tớiTrại tạm giamSố 4 Thành phố Trường Xuân.
They accused her of “subverting state power” because she promoted Falun Gong outsid the Jilin University No. 1 Hospital.,Họ buộc tội bà “lật đổ quyền lực nhà nước” vì bà quảng bá Pháp Luân Công bên ngoài Bệnh viện Số 1 Đại học Cát Lâm.
They also threatened to sentence her.,Họ cũng đe dọa kết án bà.
"The Kuancheng District Court held a hearing of Ms. Yang’s case on November 21, 2022, without allowing her family to attend.",Tòa án Khoan Thành đã mở phiên tòa xét xử bà Dương vào ngày 21 tháng 11 năm 2022 mà không cho người nhà bà tham dự.
"According to an insider who was present during the hearing, Ms. Yang refused to plead guilty.","Theo một người trong cuộc có mặt trong phiên tòa, bà Dương đã từ chối nhận tội."
"Ms. Yang’s family was informed in January 2023 that she had been sentenced to 1.5 years and transferred to the Weizigou Supervision Center, where she was awaiting the result of her appeal.","Tháng 1 năm 2023, gia đình bà Dương được thông báo rằng bà đã bị kết án 1,5 năm và bị chuyển đến Trung tâm Quản giáo Vĩ Tử Câu, nơi bà bị giam giữ trong khi chờ kết quả kháng cáo."
"She was transferred to the Jilin Province Women’s Prison on August 11, 2023 after her appeal was denied.","Sau khi kháng cáo của bà bị bác bỏ, vào ngày 11 tháng 8 năm 2023, bà bị chuyển đến Nhà tù Nữ Tỉnh Cát Lâm."
"At least 13 Falun Gong practitioners in Zhucheng City, Shandong Province were arrested for their faith on July 24, 2023."," Vào ngày 24 tháng 7 năm 2023, ít nhất 13 học viênPháp Luân Côngở thành phố Chư Thành, tỉnh Sơn Đông đã bị bắt giữ vì đức tin của họ."
One of them has been sentenced to 14 months.,Một người trong số họ đã bị kết án lên đến 14 tháng tù.
"Falun Gong, also known as Falun Dafa, is a spiritual discipline that has been persecuted by the Chinese communist regime since 1999.","Pháp Luân Công, còn được gọi làPháp Luân Đại Pháp, là một môn tu luyện đã bị chính quyền cộng sản Trung Quốc đàn áp từ năm 1999."
"The 13 practitioners are Ms. Sun Yuhua, Ms. Wang Wenqin, Mr. Sun Li, Mr. Wang Xuebin, Ms. Liu Shuhua, Ms. Lin Jinxiu, Mr. Zang Yunchun, Ms. Chen Xuefen, Ms. Ren Chengju, Ms. Cao Rongying, Ms. Cao Ying, Ms. Wang Xianhua, and Ms. Wang Jinxiu.","13 học viên bị bắt giữ gồm có bà Tôn Ngọc Hoa, bà Vương Văn Cầm, ông Tôn Lập, ông Uông Học Bân, bà Lưu Thục Hoa, bà Lâm Kim Tú, ông Tàng Vận Xuân, bà Trần Học Phân, bà Nhậm Thành Cúc, bà Tào Vinh Anh, Bà Tào Anh, bà Vương Tiên Hoa và bà Vương Kim Tú."
"A 14th practitioner, Ms. Zhao Qinghua, escaped the arrest and has been forced to live away from home to hide from the police.","Học viên thứ 14 là bà Triệu Thanh Hoa, đã trốn thoát khỏi bị bắt giữ, nhưng hiện đang phải sống tha hương để trốn tránh cảnh sát."
"Insiders revealed that some other practitioners were also arrested on the same day, but there were no available details about it at the time of writing.","Những người trong cuộc tiết lộ rằng, một số học viên khác cũng bị bắt giữ cùng ngày, nhưng hiện chưa có thông tin chi tiết về vụ việc."
"The arrests were conducted by officers from Zhucheng City Domestic Security Office, Renmin Road Police Station, and Mizhou Road Police Station.","Các vụ bắt giữ do nhân viên từ Phòng An ninh Nội địa Thành phố Chư Thành, Đồn Cảnh sát Đường Nhân Dân và Đồn Cảnh sát Đường Mật Châu cùng thực hiện."
Most of the practitioners also had their homes ransacked.,Hầu hết các học viên đều bị lục soát nhà.
"In Ms. Liu’s home, her beddings were thrown on the floor and many of her valuables, including cash, gold jewelry, and the house deed were gone.","Tại nhà bà Lưu Thục Hoa, ga trải giường của bà bị ném xuống sàn, trong khi nhiều đồ dùng có giá trị của bà, bao gồm cả tiền mặt, đồ trang sức bằng vàng và giấy tờ nhà đều biến mất."
The practitioners were held in the Zhujie Brainwashing Center and ordered to renounce Falun Gong.,Các học viên bị giam giữ tại Trung tâm Tẩy não Chu Giải và bị ép buộc phải từ bỏ tu luyện Pháp Luân Công.
"Those who remained firm in upholding their faith have been transferred to the Weifang Detention Center on August 5, including Ms. Liu, Ms. Lin, and Ms. Wang Wenqin.","Những người kiên định giữ vững đức tin của mình đã bị chuyển đến Trại giam Duy Phường vào ngày 5 tháng 8, bao gồm cả bà Lưu Thục Hoa, bà Lâm Kim Tú và bà Vương Văn Cầm."
It was revealed by an insider that Ms. Chen was taken to the Weifang City Detention Center on the day of the arrest and handed a 14-month term.,"Một người trong cuộc tiết lộ, bà Trần Học Phân đã bị đưa đến Trại giam Thành phố Duy Phường vào ngày bị bắt và bị tuyên án 14 tháng tù."
But details about her sentencing aren’t clear.,Tuy nhiên hiện vẫn chưa xác minh rõ chi tiết về bản án của bà.
"Nine Weihai City, Shandong Province, residents, all of them employees of the local Wendeng City Tapestry Factory, stood trial on August 24, 2023 for their shared faith in Falun Gong, a mind-body practice that has been persecuted by the Chinese Communist Party since July 1999."," Chín cư dân ở thành phố Uy Hải, tỉnh Sơn Đông, đều là nhân viên Nhà máy Thảm Thành phố Văn Đăng, bị đưa ra xét xử vào ngày 24 tháng 8 năm 2023 chỉ vì đức tin chung của họ vàoPháp Luân Công, một môn tu luyện đã bị Đảng Cộng sản Trung Quốc (ĐCSTQ) bức hại kể từ tháng 7 năm 1999."
The hearing was held at the Rongcheng City Court.,Phiên xét xử diễn ra tại Tòa án Thành phố Vinh Thành.
The presiding judge kept interrupting and threatening the practitioners as they testified in their own defense.,Chủ tọa phiên tòa liên tục ngắt lời và đe dọa các học viên khi họ tự bào chữa vô tội cho bản thân.
Other details of the hearing remain to be investigated.,Những thông tin khác về phiên tòa vẫn đang được điều tra.
"Over 200 officers were dispatched to raid the factory on July 20, 2022.",Hơn 200 cảnh sát đã được điều động đột kích nhà máy vào ngày 20 tháng 7 năm 2022.
Many structures in the garden-like factory were vandalized.,"Nhiều kiến trúc trong nhà máy, chẳng hạn như khu vườn, đã bị phá hủy."
The police also put up banners slandering Falun Gong everywhere in the factory.,Cảnh sát cũng treo các biểu ngữ phỉ báng Pháp Luân Công ở khắp nơi trong nhà máy.
Each worker was interrogated by two officers.,Mỗi công nhân bị hai cảnh sát thẩm vấn.
Some female workers cried in fear.,Một số nữ công nhân đã bật khóc vì sợ hãi.
"Eleven employees were arrested that day, including Ms. Li, her daughter Ms. Tian Tian, her sister-in-law Ms. Tian Lisha, factory accountant Ms. Liu Mingming, Ms. Qu Aiping, Mr. Zhang Yingming, Ms. Xu Changqing, Mr. Cong Xu, Ms. Lian Qingling, Mr. Jiang Changmin, and Mei (alias).","11 người đã bị bắt trong ngày hôm đó, gồm có bà Lý, con gái bà là cô Điền Điềm, em chồng bà là bà Điền Lệ Sa, kế toán trưởng nhà máy bà Lưu Minh Minh, bà Khúc Ái Bình, ông Trương Anh Minh, bà Hứa Thường Thanh, ông Tùng Hứa, bà Liên Khánh Linh, ông Khương Trường Mẫn và một công nhân khác."
"Mei was released after 12 hours, and Ms. Tian Tian was freed after 48 hours.",Người công nhân này được thả sau 12 tiếng và cô Điền Điềm được trả tự do sau 48 giờ.
"It is unclear whether Mei and Ms. Tian practiced Falun Gong, but the other nine arrested employees all did.","Không rõ người công nhân đó và cô Điền có tu luyện Pháp Luân Công không, nhưng chín người còn lại đều là học viên."
"Most of the practitioners also had their residences ransacked and their Falun Gong items, computers, and printers confiscated.","Hầu hết các học viên đều bị lục soát nơi ở. Các tài liệu Pháp Luân Công, máy tính, máy in của họ đều bị tịch thu."
"While the police allowed Ms. Tian to keep running the factory after her release, they stayed there for at least six days, during which time they questioned workers at will and severely disrupted the business' operation.","Cho dù cảnh sát cho phép cô Điền tiếp tục vận hành nhà máy sau khi được thả, tuy nhiên họ vẫn ở lại nhà máy ít nhất sáu ngày, trong thời gian đó họ tùy ý thẩm vấn nhân viên và làm gián đoạn nghiêm trọng hoạt động sản xuất kinh doanh của nhà máy."
"Because accountant Ms. Liu’s computer was confiscated, Ms. Tian was unable to pay her workers (who also lived on the factory campus) or deposit money into their meal accounts.","Vì máy tính của bà Lưu kế toán trưởng đã bị tịch thu, nên cô Điền không thể trả lương người lao động hay chuyển phụ cấp tiền ăn vào tài khoản cho họ."
She had to record everyone’s meal purchase in the factory cafeteria for them to reimburse later.,Cô phải ghi chép thủ công thông tin đăng ký suất ăn của công nhân nhà máy tại căng tin để làm căn cứ hoàn tiền cho họ sau này.
"Ms. Tian Lisha, Ms. Li, Ms. Qu, and Mr. Zhang were put under criminal detention and had their arrests approved on August 28, 2022.","Bà Điền Lệ Sa, bà Lý, bà Khúc và ông Trương đã bị tạm giam hình sự và việc bắt giữ họ đã được phê chuẩn vào ngày 28 tháng 8 năm 2022."
"Ms. Tian, Ms. Li, and Ms. Qu are currently being held at the Wendeng Detention Center.","Bà Điền, bà Lý và bà Khúc hiện đang bị giam tạiTrại tạm giamVăn Đăng."
Mr. Zhang is being detained at the Weihai Detention Center.,Ông Trương bị giam tại trại tạm giam Uy Hải.
"The other five practitioners were released on August 29 on bail and had their bail conditions approved on November 29, 2022.","Năm học viên khác đã được thả vào ngày 29 tháng 8 năm 2022 theo diện bảo lãnh, và các điều kiện tại ngoại của họ được phê chuẩn vào ngày 29 tháng 11."
"The Rongcheng CityProcuratorateindicted the nine practitioners on December 28, 2022.",Viện Kiểm sát Thành phố Vinh Thành đã truy tố chín học viên vào ngày 28 tháng 12 năm 2022.
"They appeared in Rongcheng City Court on August 24, 2023.",Họ bị Tòa án Thành phố Vinh Thành đưa ra xét xử vào ngày 24 tháng 8 năm 2023.
"Ms. Tian refuted the allegations against her, and other practitioners also testified in their own defense.","Bà Điền đã bác bỏ những cáo buộc nhắm vào bà, trong khi các học viên khác cũng tự bào chữa vô tội."
The presiding judge kept interrupting and threatening them.,Thẩm phán liên tục ngắt lời và đe dọa các học viên.
"It was recently confirmed by Minghui.org that three Ningde City, Fujian Province residents had been sentenced to prison between February and March 2023 for their faith in Falun Gong, a mind-body practice that has been persecuted by the Chinese Communist Party since July 1999."," Minghui.org gần đây đã xác nhận rằng ba cư dân thành phố Ninh Đức, tỉnh Phúc Kiến đã bị kết án tù từ tháng 2 đến tháng 3 năm 2023 vì đức tin của họ vàoPháp Luân Công, một môn tu luyện đã bị Đảng Cộng sản Trung Quốc (ĐCSTQ) bức hại từ tháng 7 năm 1999."
"Ms. Ruan Aiyin, 60, Ms. Chen Xingguang, 74, and Ms. Lin Fen, 58, were arrested on December 16, 2021.","Bà Nguyễn Ái Ngân (阮爱银) 60 tuổi, bà Trần Tinh Quang (陈星光) 74 tuổi, và bà Lâm Phần (林芬) 58 tuổi, bị bắt vào ngày 16 tháng 12 năm 2021."
"Ms. Ruan was released on bail after 26 days of detention, while Ms. Chen and Ms. Lin were taken to the Ningde City Detention Center.","Bà Nguyễn được tại ngoại sau 26 ngày bị giam giữ, trong khi bà Trần và bà Lâm bị đưa vàotrại tạm giamThành phố Ninh Đức."
"Ms. Ruan was later sentenced to six years, Ms. Chen four years, and Ms. Lin two years.","Sau đó, bà Nguyễn bị kết án sáu năm, bà Trần bốn năm, và bà Lâm hai năm."
It is unclear when the three women were indicted or sentenced.,Hiện chưa rõ ba người phụ nữ này bị truy tố hay kết án khi nào.
Ms. Ruan remains out on bail but is forced to have her pictures taken every day and closely monitored.,Bà Nguyễn vẫn được tại ngoại nhưng bị bắt phải chụp ảnh hàng ngày và bị giám sát chặt chẽ.
Ms. Chen and Ms. Lin remain at the same detention center.,Bà Trần và bà Lâm vẫn bị giam ở cùng một trại tạm giam.
