"Led by Sir Geoffrey Nice KC, the China Tribunal investigated this for several months and announced on June 17, 2019, that, “forced organ harvesting has been committed for years throughout China on a significant scale and that Falun Gong practitioners have been one—and probably the main—source of organ supply.” “Commission of Crimes Against Humanity against the Falun Gong... has been proved beyond reasonable doubt...”","Dưới sự lãnh đạo của Ngài Geoffrey Nice KC (Cố vấn của Vua nước Anh), Tòa án Luận tội Trung Quốc (China Tribunal) đã điều tra về vấn đề này mấy tháng liền, và đã tuyên bố vào ngày 17 tháng 6 năm 2019 rằng “nạn cưỡng bức thu hoạch nội tạng đã diễn ra nhiều năm qua trên quy mô lớn ở khắp Trung Quốc, và các học viên Pháp Luân Công là một nguồn nội tạng trong đó – và có lẽ là nguồn chính… Việc phạm tội ác chống lại loài người đối với Pháp Luân Công… đã được chứng minh là không còn gì để nghi ngờ gì nữa…”"
"The China Tribunal published the full judgment on March 1, 2020.","Ngày 1 tháng 3 năm 2020, Tòa án Luận tội Trung Quốc đã công bố toàn bộ phán quyết."
The document contains 160 pages of text and over 300 pages of testimonies from witnesses.,Tài liệu này gồm 160 trang văn bản và hơn 300 trang lời khai của các nhân chứng.
Sir Nice KC has stated that no one has questioned the details of the judgment since it was published.,"Ngài Nice KC đã tuyên bố rằng từ khi phán quyết được công bố, chưa có một ai nghi vấn về các chi tiết của nó."
The international community has paid increasing attention to the CCP’s crime of organ harvesting.,Cộng đồng quốc tế ngày càng chú ý đến tội ác thu hoạch nội tạng của ĐCSTQ.
Many countries have passed legislation to stop their people from going to China for illegal organ transplants.,Nhiều quốc gia đã thông qua luật ngăn chặn công dân nước mình sang Trung Quốc để cấy ghép nội tạng bất hợp pháp.
"Some laws also sanctioned individuals involved in organ harvesting, including revoking their passports, freezing their assets, and imposing up to 20 years of imprisonment along with a one-million-dollar fine.","Một số luật cũng xử phạt những cá nhân dính líu đến nạn thu hoạch nội tạng, dưới những hình thức như thu hồi hộ chiếu, phong tỏa tài sản, và phạt tù lên đến 20 năm cùng khoản tiền phạt 1 triệu đô la."
Spain,Tây Ban Nha
"Oscar Garay of Spain went to Tianjin on November 11, 2008, for an illegal organ transplant.","Ngày 11 tháng 11 năm 2008, ông Oscar Garay người Tây Ban Nha đã đến Thiên Tân để cấy ghép nội tạng bất hợp pháp."
"The procedure took 20 days and cost $130,000.",Thủ tục này mất 20 ngày và tốn 130.000 USD.
"When Garay talked about his trip in 2010, the public learned that the liver he received came from an illegal source.","Năm 2010, khi ông Garay kể về chuyến đi của mình, dư luận mới biết lá gan mà ông nhận được có nguồn gốc bất hợp pháp."
United States,Hoa Kỳ
"The U.S. House of Representatives passed a bipartisan bill (413 to 2) on March 27, 2023, to oppose the state-sanctioned forced organ harvesting in China.","Ngày 27 tháng 3 năm 2023, Hạ viện Hoa Kỳ đã thông qua dự luật lưỡng đảng (với tỷ lệ 413 phiếu thuận, 2 phiếu nghịch) nhằm phản đối nạn cưỡng bức thu hoạch nội tạng dưới sự hậu thuẫn của chính quyền Trung Quốc."
"Also known as H.R.1154 – The Stop Forced Organ Harvesting Act of 2023, this was the first bill passed with a bipartisan majority to hold the Chinese Communist Party (CCP) accountable for these crimes.","Đạo luật Ngăn chặn Cưỡng bức Thu hoạch Nội tạng 2023, còn được gọi là H.R.1154, là dự luật đầu tiên được thông qua với tỷ lệ đa số của cả hai đảng nhằm truy cứu trách nhiệm của Đảng Cộng sản Trung Quốc (ĐCSTQ) vì những tội ác này."
The United States Capitol,Tòa nhà Quốc hội Hoa Kỳ
H.R.1154 – The Stop Forced Organ Harvesting Act of 2023 was passed on March 27.,H.R.1154 – Đạo luật Chấm dứt nạn Cưỡng bức Thu hoạch Nội tạng năm 2023 được thông qua vào ngày 27 tháng 3.
"The bill reads: “The President must report to Congress a list of persons that facilitate (1) forced organ harvesting, or (2) trafficking in persons for organ harvesting.","Dự luật có đoạn: “Tổng thống phải trình lên Quốc hội danh sách những người tiếp tay cho (1) nạn cưỡng bức thu hoạch nội tạng, hoặc (2) nạn buôn bán người để thu hoạch nội tạng."
"For each person on the list, the President must impose property- and visa-blocking sanctions.”","Với mỗi người có tên trong danh sách này, Tổng thống phải áp dụng các biện pháp trừng phạt phong tỏa tài sản và cấm thị thực.”"
"In addition, “the State Department may deny or revoke the passport of an individual who has been convicted of a federal crime of knowingly transferring any human organ for valuable consideration for use in human transplantation, if the individual (1) is subject to imprisonment or supervised release resulting from that conviction, and (2) used a passport or crossed an international border when committing that crime.”","Ngoài ra, “Bộ Ngoại giao có thể từ chối hoặc thu hồi hộ chiếu của người đã bị kết án là tội phạm liên bang do cố ý chuyển giao bất kỳ bộ phận cơ thể người nào để xem xét sử dụng cho hoạt động cấy ghép ở người nếu người đó (1) bị phạt tù hoặc được thả ra dưới diện quản thúc sau khi bị kết án như vậy, và (2) sử dụng hộ chiếu hoặc vượt biên giới quốc tế khi phạm tội đó.”"
"Furthermore, the Act imposes against such crimes: 1) civil penalties including a fine of up to $250,000, and 2) criminal penalties including a fine of up to $1 million and imprisonment for not more than 20 years for such crimes.","Hơn nữa, Đạo luật này còn áp đặt cho các tội như: 1) hình phạt dân sự bao gồm phạt tiền lên tới 250.000 đô la và 2) hình phạt hình sự bao gồm phạt tiền lên tới 1 triệu đô la và phạt tù không quá 20 năm đối với những tội như vậy."
"“Ethnic groups targeted for mass harvesting include Uyghurs—who suffer from Xi Jinping’s ongoing genocide—and the Falun Gong, whose peaceful meditation and exercise practices—and exceptional good health—make their organs highly desirable.”",“Các nhóm dân tộc là mục tiêu của nạn thu hoạch hàng loạt như người Duy Ngô Nhĩ – đang phải chịu đựng nạn diệt chủng đang diễn ra của Tập Cận Bình – và các học viên Pháp Luân Công tập thiền và các bài tập ôn hòa – có sức khỏe đặc biệt tốt – khiến nội tạng của họ rất được ưa chuộng.”
"Tom Cotton, Republican Senator, and Chris Coons, Democratic Senator, initiated a Senate version of the legislation along with more than ten other senators.","Ông Tom Cotton, Thượng nghị sỹ Đảng Cộng hòa, và ông Chris Coons, Thượng nghị sỹ Đảng Dân chủ, đã cùng cùng mười mấy thượng nghị sỹ khác đề xuất dự luật của Thượng viện."
The European Union,Liên minh Châu Âu
"The Convention Against Trafficking in Human Organs was also adopted by the European Committee of Ministers on July 9, 2014.","Ngày 9 tháng 7 năm 2014, Ủy ban Bộ trưởng Châu Âu cũng đã thông qua Công ước Chống Buôn bán Nội tạng Người."
It banned transnational illegal organ trade and requested its member countries to stop such crimes.,Công ước này cấm buôn bán nội tạng bất hợp pháp xuyên quốc gia và yêu cầu các nước thành viên hành động để chấm dứt những tội ác này.
"This convention is in force in the five first states that have so far ratified it: Albania, the Czech Republic, Malta, the Republic of Moldova, and Norway on March 1, 2018.","Công ước này có hiệu lực ở năm quốc gia đầu tiên phê chuẩn công ước vào ngày 1 tháng 3 năm 2018, gồm: Albania, Cộng hòa Séc, Malta, Cộng hòa Moldova và Na Uy."
"Another 17 countries also signed the convention, including Belgium, Greece, Italy, Ireland, and Latvia.","17 quốc gia khác cũng đã ký kết công ước, trong đó có Bỉ, Hy Lạp , Ý, Ireland, và Latvia."
"In April 2019, Belgium passed a new bill that criminalizes all activities involved in the buying and selling of human organs for commercial use.","Tháng 4 năm 2019, Bỉ đã thông qua dự luật mới, trong đó quy định mọi hoạt động liên quan đến mua bán nội tạng người vì mục đích thương mại đều là phạm tội hình sự."
The United Kingdom,Vương quốc Anh
The UK’s Health and Care Bill became an Act of Parliament in April 2022,Dự luật Chăm sóc Y tế của Vương quốc Anh đã thành Đạo luật của Quốc hội vào tháng 4 năm 2022
The Health and Care Bill became an Act of the UK Parliament in late April 2022.,"Cuối tháng 4 năm 2022, Dự luật Chăm sóc và Sức khỏe đã trở thành Đạo luật của Quốc hội Vương quốc Anh."
"Based on moral risks, it barred UK citizens from traveling to China or other countries to purchase organs for transplant.","Trên cơ sở rủi ro về mặt đạo đức, đạo luật này cấm công dân Vương quốc Anh du lịch sang Trung Quốc hoặc các quốc gia khác mua nội tạng để cấy ghép."
This act also charges UK citizens involved in organ trade as criminals.,Đạo luật này cũng khép công dân Anh nào có liên quan đến buôn bán nội tạng vào tội hình sự.
This Act is an extension of the UK’s existing legislation.,Đạo luật này là phần mở rộng của luật pháp hiện hành của Vương quốc Anh.
"In addition to banning domestic organ trade, it also added details for overseas organ trade.","Ngoài cấm buôn bán nội tạng trong nước, đạo luật này còn bổ sung chi tiết về buôn bán nội tạng ở nước ngoài."
UK news media said this Act was a result of joint efforts from parliament members who strove to end organ harvesting in China.,Các hãng thông tấn Anh cho biết Đạo luật này là kết quả của những nỗ lực chung của các nghị sỹ quốc hội đang nỗ lực nhằm chấm dứt nạn thu hoạch nội tạng ở Trung Quốc.
Italy,Ý
A bill was passed by the Italian parliament in December 2016 to impose strict punishment on whoever sells human organs.,"Tháng 12 năm 2016, Quốc hội Ý đã thông qua một dự luật nhằm áp đặt hình phạt nghiêm khắc đối với bất cứ ai buôn bán nội tạng người."
"This legislation went into effect on January 7, 2017.",Luật này có hiệu lực vào ngày 7 tháng 1 năm 2017.
"According to law, anyone involved in trading, selling, buying, obtaining, or processing organs from living people faces three to 12 years of imprisonment and a fine of between 300,000 and 500,000 euros.","Theo luật, bất kỳ ai liên quan đến buôn bán, mua, lấy hoặc xử lý nội tạng từ người sống đều có khả năng bị kết án tù từ 3 đến 12 năm và phạt tiền từ 300.000 đến 500.000 euro."
"If a health care professional is responsible, this individual will be barred from the profession for their entire lifetime.",Chuyên gia ý tế nếu dính líu vào hoạt động này thì sẽ bị cấm hành nghề suốt đời.
Canada,Canada
"Bill S-223 (An Act to amend the Criminal Code and the Immigration and Refugee Protection Act [trafficking in human organs]) was unanimously passed in the Canadian Parliament on December 14, 2022.",Dự luật S-223 (Đạo luật sửa đổi Bộ luật Hình sự và Đạo luật Bảo vệ Người nhập cư và Dân tị nạn [khỏi nạn buôn bán nội tạng người]) được nhất trí thông qua tại Quốc hội Canada vào ngày 14 tháng 12 năm 2022.
"The Canadian House of Commons unanimously passed Bill S-223 to combat illegal human organ harvesting and trafficking with 324 votes on December 14, 2022.","Ngày 14 tháng 12 năm 2022, Hạ viện Canada đã nhất trí thông qua Dự luật S-223 với 324 phiếu nhằm đấu tranh chống nạn thu hoạch và buôn bán nội tạng người bất hợp pháp."
The bill is considered to be an important legal basis for Canada’s crackdown on forced live organ harvesting.,Dự luật này được coi là cơ sở pháp lý quan trọng để Canada chế áp nạn cưỡng bức thu hoạch nội tạng sống.
Bill S-223 was originally sponsored by Senator Salma Ataullahjan.,Dự luật S-223 ban đầu do Thượng nghị sỹ Salma Ataullahjan bảo trợ.
The bill proposes strengthening Canada’s regulation of human organ trafficking by amending the Criminal Code to create new offenses against trafficking in human organs and expanding extraterritorial jurisdiction for the new offense.,Dự luật này đề xuất tăng cường quy định của Canada về buôn bán nội tạng người bằng cách sửa đổi Bộ luật Hình sự để lập ra các tội danh mới đối với hoạt động buôn bán nội tạng người và mở rộng quyền tài phán ra ngoài lãnh thổ đối với các tội danh mới này.
The bill also seeks to amend theImmigration and Refugee Protection Actto prohibit permanent residents or foreign nationals from entering Canada if they engage in organ removal and trafficking without informed consent.,Dự luật cũng đề xuất sửa đổi Đạo luật Bảo vệ Người nhập cư và Dân tị nạn để cấm cư dân thường trú hoặc công dân nước ngoài vào Canada nếu họ từng tham gia vào hoạt động mổ lấy nội tạng và buôn bán nội tạng mà không có sự đồng thuận minh bạch của người hiến tạng.
Israel,Israel
"Israel introduced legislation in 2008 adding restrictions regarding its citizens traveling overseas for illegal organs, a behavior known as “organ tourism.” This legislation also barred insurance companies from paying for citizens' organ tourism in China.","Năm 2008, Israel đưa ra luật nhằm bổ sung các hạn chế liên quan đến công dân của họ ra nước ngoài để lấy nội tạng bất hợp pháp dưới danh nghĩa “du lịch ghép tạng.” Đạo luật này cũng cấm các công ty bảo hiểm chi trả cho công dân sang Trung Quốc để du lịch ghép tạng."
Taiwan,Đài Loan
"The Taiwanese Congress passed new amendments to the already established Human Organ Transplantation Act on June 12, 2015, creating a far-reaching new Organ Trafficking Law (OTL).","Quốc hội Đài Loan đã thông qua các nội dung sửa đổi mới đối với Đạo luật Cấy ghép Nội tạng Người hiện hành được ban hành vào ngày 12 tháng 6 năm 2015, từ đó đưa ra Luật Buôn bán Nội tạng (OTL) mới có ảnh hưởng sâu rộng."
"With this ground-breaking legislation, Taiwan has passed one of the most extensive medical transplant laws in the world.","Với hành động lập pháp mang tính đột phá này, Đài Loan đã thông qua một trong những luật cấy ghép y tế rộng nhất trên thế giới."
"The law prohibits the selling, buying, and brokering of organs and transplant tourism.","Luật này nghiêm cấm mua, bán, và môi giới nội tạng và du lịch ghép tạng."
The Department of Health will now require major medical institutions and physicians to register the country of all organ sources and the hospital’s information (including surgeon identification) where patients received their organ transplants abroad when they apply for postoperative health insurance payments after returning home.,"Bộ Y tế hiện sẽ yêu cầu các tổ chức y tế lớn và các bác sỹ phải ghi lại quốc gia của mọi nguồn nội tạng cũng như thông tin về bệnh viện nước ngoài nơi bệnh nhân thực hiện cấy ghép nội tạng (kể cả số định danh của bác sỹ phẫu thuật) khi họ làm thủ tục thanh toán bảo hiểm y tế sau phẫu thuật, sau khi về nước."
Patients receiving illegal organ transplants overseas will face a maximum of five years in prison and an NT$1.5 million.,"Bệnh nhân cấy ghép nội tạng bất hợp pháp ở nước ngoài sẽ phải chịu mức án tối đa 5 năm tù và bị phạt 1,5 triệu Đài tệ."
"If doctors engage in organ brokerage, their medical license may be canceled.",Bác sỹ tham gia vào việc môi giới nội tạng thì có thể bị hủy giấy phép hành nghề.
Recent Legislation,Các hành động lập pháp gần đây
"Kevin Lamoureux, Canadian Parliamentary Secretary and Liberal MP for North Winnipeg, Manitoba, said in July 2023 that the Canadian government should seize every opportunity to call for an end to the persecution.","Tháng 7 năm 2023, ông Kevin Lamoureux, Thư ký Quốc hội kiêm Nghị sỹ Quốc hội Canada thuộc Đảng Tự do ở Bắc Winnipeg, Manitoba, cho biết, chính phủ Canada cần phải tận dụng mọi cơ hội để kêu gọi chấm dứt cuộc bức hại này."
"For years, Lamoureux has been paying attention to the CCP’s live organ harvesting and has worked on legislation to stop it.","Nhiều năm qua, ông Lamoureux đã chú ý đến nạn thu hoạch nội tạng sống của ĐCSTQ và đã nỗ lực xây dựng luật để ngăn chặn hoạt động này."
"He said that almost all Canadians take the issue seriously: “To see people that are being kept alive and organs being torn out of their body, and then left to die, it’s horrific.","Ông cho biết hầu hết người dân Canada đều coi trọng vấn đề này: “Chứng kiến những người đang được duy trì mạng sống và nội tạng bị moi ra khỏi cơ thể họ, rồi bị bỏ mặc cho đến chết, thật là khủng khiếp."
I find it completely unacceptable as someone that believes in the importance of human rights.,"Là một người tin vào tầm quan trọng của nhân quyền, tôi thấy hoàn toàn không thể chấp nhận được.”"
"“I think that’s probably the most important thing, because whether it’s Canada or like-minded nations, I believe that, at the end of the day, it’s going to be the pressures from governments, pressures from within places like China, that are ultimately going to have to win the day,” he said.","“Tôi nghĩ đó có lẽ là điều quan trọng nhất, bởi vì dù là Canada hay các quốc gia khác có cùng quan điểm, tôi tin rằng, cuối cùng thì áp lực từ các chính phủ, áp lực từ nội bộ các nơi như ở Trung Quốc, rồi nhất định sẽ giành chiến thắng”, ông nói."
"Tony Brunt, former City Councilor of Wellington, New Zealand, said in July 2023: “The CCP has organized organ harvesting and the murder of innocent people.","Tháng 7 năm 2023, ông Tony Brunt, cựu Ủy viên Hội đồng Thành phố Wellington, New Zealand, cho biết: “ĐCSTQ đã tổ chức thu hoạch nội tạng và sát hại những người vô tội."
This is an act of incomprehensible evil.,Đây là một hành động tàn ác đến không sao hiểu nổi.
"The CCP regime is a regime that has committed the worst crime against humanity since the Holocaust in World War II, [it is] a regime that operates outside the boundaries of our planetary civilization.","Chính quyền ĐCSTQ là một chính quyền đã phạm tội ác chống lại loài người nghiêm trọng nhất kể từ vụ thảm sát dân Do Thái của Đức quốc xã trong Thế chiến Thứ hai, [nó] là một chính quyền hoạt động bên ngoài ranh giới của nền văn minh hành tinh chúng ta.”"
“The CCP’s human rights violations are widespread and long-standing.,“Những hành vi vi phạm nhân quyền của ĐCSTQ đã rất phổ biến và tồn tại quá lâu.
"The authoritarian system imposed by the CCP is a threat not only to Chinese citizens but also to established norms of civilization and the human rights of the international community,” he said.","Chế độ độc tài mà ĐCSTQ áp đặt là mối đe dọa không chỉ đối với người dân Trung Quốc mà cả đối với các chuẩn mực văn minh và nhân quyền đã được xác lập của cộng đồng quốc tế”, ông nói."
"Brunt said that the CCP is an illegal organization and that its human rights violations, torture, and murder condoned by the judiciary, police, and prison system, as well as organ harvesting and transplantation crimes, should be investigated.","Ông Brunt nói rằng ĐCSTQ là một tổ chức bất hợp pháp, và rằng các hành vi vi phạm nhân quyền, tra tấn, và giết người dưới sự dung túng của hệ thống tư pháp, cảnh sát và nhà tù, cũng như tội ác thu hoạch nội tạng và cấy ghép nội tạng cần phải được điều tra."
"The case against Ms. Liu Guibi, 81, from Chongqing was heard in the Jiangbei District Court on July 4, 2023."," Bà Lưu Quế Bích, 81 tuổi, đến từ Trùng Khánh đã bị đưa ra xét xử tại Tòa án quận Giang Bắc vào ngày 4 tháng 7 năm 2023."
"Ms. Liu was on trial for practicing Falun Gong, a spiritual discipline that has been persecuted by the Chinese Communist Party since July 1999.","Bà Lưu bị xét xử vì tu luyệnPháp Luân Công, một môn tu luyện bị Đảng Cộng sản Trung Quốc bức hại từ tháng 7 năm 1999."
The five people presiding over the hearing left before Ms. Liu Guibi finished her defense statement.,Năm người chủ trì phiên xét xử đã rời đi trước khi bà Lưu Quế Bích kết thúc phần bào chữa của mình.
She thought the court was in recess but no one returned.,Bà tưởng tòa đang nghỉ giải lao nhưng không có ai quay lại.
Then the court-appointed driver who brought her to the court came and said that the hearing ended.,"Sau đó, tài xế do tòa chỉ định, người đã đưa bà đến tòa, tới và nói rằng phiên xét xử đã kết thúc."
He drove her home.,Rồi anh ta chở bà về nhà.
The court later delivered a guilty verdict to Ms. Liu’s home.,Tòa án sau đó đã chuyển bản tuyên án có tội tới nhà bà Lưu.
She was sentenced to six months in prison.,Bà bị kết án sáu tháng tù giam.
"Not long after, the court notified her that the trial was declared a mistrial and they planned to schedule a new trial.","Không lâu sau, tòa án thông báo rằng phiên xét xử có sự nhầm lẫn và họ dự định sắp xếp một phiên xét xử mới."
The six-month sentence was thus nullified.,"Do đó, bản án sáu tháng đã bị hủy bỏ."
"This latest persecution of Ms. Liu stemmed from her arrest on February 16, 2023, when she was reported for talking to people about Falun Gong in Beipei District, Chongqing.","Bức hại gần nhất này của bà Lưu bắt đầu từ vụ bắt giữ bà vào ngày 16 tháng 2 năm 2023, khi bà bị tố cáo vì nói chuyện với người dân về Pháp Luân Công ở quận Bắc Bội, Trùng Khánh."
The arresting officers from the Jingguan Town Police Station also raided her home and confiscated a few Falun Gong books.,Các viên chức thực hiện vụ bắt giữ đến từ đồn cảnh sát thị trấn Tĩnh Quan cũng đã đột nhập vào nhà bà và tịch thu một số sách Pháp Luân Công.
They released her on bail around midnight that day.,Họ đã cho bà tại ngoại vào khoảng nửa đêm cùng ngày.
"The Beipei DistrictProcuratorateindicted Ms. Liu on April 18, and forwarded her case to the Jiangbei District Procuratorate on April 26.","Viện kiểm sát quận Bắc Bộ đã truy tố bà Lưu vào ngày 18 tháng 4, và chuyển vụ án của bà cho Viện kiểm sát quận Giang Bắc vào ngày 26 tháng 4."
The procuratorate then submitted her case to the Jiangbei District Court.,Viện kiểm sát sau đó đã đệ trình vụ việc của bà lên Tòa án quận Giang Bắc.
This is not the first time that Ms. Liu has been targeted for her faith.,Đây không phải là lần đầu tiên bà Lưu Quế Bích trở thành mục tiêu bị bức hại vì đức tin của mình.
"For nearly two years since the spring of 2000, she was held at various local brainwashing centers.","Trong gần hai năm kể từ mùa xuân năm 2000, bà đã bị giam tại nhiều trung tâm tẩy não ở địa phương."
The goal was to force her to renounce Falun Gong.,Mục đích là buộc bà phải từ bỏ Pháp Luân Công.
She was once held at the Beipei District Lockup for seven days and the Beipei District Detention Center for one month.,"Bà từng bị giam giữ bảy ngày tại trại giam quận Bắc Bội, và một tháng tạitrại tạm giamquận Bắc Bội."
