Sometimes the guards hung a big board with information smearing Falun Gong on her neck and forced her to kneel down to humiliate her.,"Đôi khi, lính canh còn treo một tấm bảng lớn có thông tin bôi nhọ Pháp Luân Công lên cổ bà và bắt bà phải quỳ xuống hòng làm nhục bà."
"When she refused to kneel, they pulled her arms up from behind.","Khi bà không hợp tác, họ kéo tay bà ngược lên từ phía sau."
"A Meizhou City, Guangdong Province, resident was sentenced to two and a half years following a court hearing in July 2023 for his faith in Falun Gong, a mind-body practice that has been persecuted by the Chinese Communist Party since July 1999."," Một cư dân ở thành phố Mai Châu, tỉnh Quảng Đông bị kết án 2,5 năm tù sau phiên xử hồi tháng 7 năm 2023, vì đức tin của ông vàoPháp Luân Công, một pháp môn tu luyện đã bị Đảng Cộng sản Trung Quốc bức hại kể từ tháng 7 năm 1999."
"Mr. Xie Hankui was arrested at home on February 24, 2023, weeks after the Internet police spotted the words “Why There Is Mankind” in a message he posted in a chat room on social media.","Ông Tạ Hán Khuê bị bắt tại nhà vào ngày 24 tháng 2 năm 2023, vài tuần sau khi cảnh sát Internet phát hiện dòng chữ “Vì sao có nhân loại” trong tin nhắn mà ông đăng trong một phòng trò chuyện (chat room) trên mạng xã hội."
Falun Gong’s founder wrote an article titled “Why There Is Mankind” in January 2023 and the police thus accused Mr. Xie of promoting Falun Gong information online.,Nhà sáng lập Pháp Luân Công đã viết một bài viết có tựa đề “Vì sao có nhân loại” vào tháng 1 năm 2023 và do đó công an đã cáo buộc ông Tạ quảng bá thông tin Pháp Luân Công trên mạng.
"While Mr. Xie was released on the same day, he was arrested again two days later and given criminal detention.","Mặc dù hôm đó ông Tạ đã được thả ra trong ngày, nhưng 2 ngày sau ông lại bị bắt trở lại và giam giữ hình sự."
A formal arrest warrant against him was issued on March 13.,Lệnh bắt chính thức đối với ông được ban hành vào ngày 13 tháng 3.
The Meixian District Court held a hearing of Mr. Xie’s case on July 13.,Tòa án quận Mai Huyện đã tổ chức phiên tòa xét xử ông Tạ vào ngày 13 tháng 7.
His wife was barred from attending it.,Vợ ông bị cấm tham dự phiên tòa.
Their son was initially allowed to enter the courthouse but was soon escorted out.,Con trai họ ban đầu được phép vào bên trong phòng xét xử nhưng lại nhanh chóng bị hộ tống ra ngoài.
The court claimed that both the mother and son were listed as prosecution witnesses and thus not allowed to attend the hearing.,Tòa án cho rằng hai mẹ con đều được liệt vào danh sách nhân chứng truy tố nên không được phép tham dự phiên tòa.
They merely answered the questions when the police asked on the day of Mr. Xie’s initial arrest (February 24) and were shocked to learn that their words had been used against their loved one without their knowledge or consent.,"Họ chỉ trả lời các câu hỏi khi cảnh sát hỏi họ vào ngày ông Tạ bị bắt lần đầu (24 tháng 2) và bị sốc khi biết những câu lời đó của họ lại bị dùng làm bằng chứng chống lại người thân yêu của họ, trong khi họ không hề hay biết và cũng không đồng ý."
One day in July 2023 I went to a bus station to talk with people about Falun Dafa and the persecution as I usually do.," Một ngày vào tháng 7 năm 2023, tôi đến bến xe buýt để nói với mọi người về Pháp Luân Đại Pháp và cuộc bức hại như thường lệ."
Almost everyone I talked to was receptive to what I said and also agreed to quit the Chinese Communist Party (CCP) and its related organizations.,Đa số mọi người đều tiếp thu những gì tôi nói và đồng ý thoái Đảng Cộng sản Trung Quốc và các tổ chức của nó (Đoàn và Đội).
I was pretty happy.,Tôi khá hài lòng.
The sister pointed to the sky and pointed to her mouth expecting her brother to interpret her meaning.,Người em chỉ tay lên trời và chỉ vào miệng để người anh diễn giải ý mà bà ấy muốn nói.
The brother said: “My sister wants you to help us quit the CCP.,Người anh nói: “Em gái tôi muốn cô giúp chúng tôi thoái xuất khỏi ĐCSTQ.
Someone told us about doing that before but we did not understand the significance of doing so back then.,Trước đây có người đã bảo chúng tôi làm tam thoái rồi nhưng lúc đó chúng tôi không biết tầm quan trọng của việc này.
"She joined the Youth League in the past, and I am a Party member.","Em tôi trước đây có gia nhập Đoàn, còn tôi là Đảng viên."
Can you help us?”,Cô có thể giúp chúng tôi được không?”
"I was very glad to hear that and I furtherclarified the factsto them: “Falun Dafa teaches people to be good and kind, thereby elevating the morals of society.","Tôi rất vui khi nghe thấy điều này và giảng chân tướng sâu thêm cho họ: “Pháp Luân Đại Pháp chỉ dạy mọi người trở nên thiện lương, nhân hậu, từ đó giúp nâng cao tiêu chuẩn đạo đức của xã hội."
"Meanwhile, when one elevates one’s character, one’s health improves.",Đồng thời khi người ta đề cao tâm tính thì sức khoẻ cũng được cải thiện.
"Falun Dafa’s principles resonate with people all over the world, and it has spread to over 100 countries.",Các nguyên lý của Pháp Luân Đại Pháp đã gây được tiếng vang với mọi người trên toàn thế giới và pháp môn này đã hồng truyền đến hơn 100 quốc gia.
The CCP has been persecuting Chinese people since it seized power and has specifically targeted Falun Dafa practitioners for the last 24 years.,ĐCSTQ đã bức hại người dân từ khi nó đoạt chính quyền và đặc biệt nhắm vào các học viên Pháp Luân Đại Pháp trong 24 năm qua.
Heaven will eliminate the CCP; that is why we want people to quit the CCP and its organizations to ensure their safe future.,Trời sẽ diệtTrung Cộng; đó là lý do tại sao chúng tôi muốn mọi người làm tam thoái để đảm bảo tương lai an toàn.
I will use an alias to help you both quit the Party.”,Tôi sẽ dùng hoá danh để giúp hai anh em thoái Đảng nhé“.
The siblings listened to me with full attention.,Hai anh em lắng nghe tôi nói một cách chăm chú.
I also gave them many materials that contained information about Falun Dafa.,Tôi cũng tặng họ các tài liệu thông tin Pháp Luân Đại Pháp.
I told them to sincerely recite “Falun Dafa is good; Truthfulness-Compassion-Forbearance is good” so that they would be blessed and protected by Dafa.,Tôi bảo họ thành tâm niệm “Pháp Luân Đại Pháp hảo; Chân-Thiện-Nhẫn hảo” thì sẽ được Đại Pháp ban phúc và bảo hộ.
"As soon as I said that, his sister suddenly shouted out loud: “Falun Dafa is good!","Ngay khi tôi vừa nói dứt lời, người em bất ngờ hô lớn: “Pháp Luân Đại Pháp hảo!"
Truthfulness-Compassion-Forbearance is good!” Her brother was shocked.,Chân-Thiện-Nhẫn hảo!” Anh trai của bà ấy chấn động.
He hugged his sister and began to cry.,Ông ôm chầm em gái và bật khóc.
Many people near us looked to see what was going on.,Nhiều người ở gần đó cũng nhìn xem chuyện gì đang xảy ra.
"When they learned the situation, they were visibly moved, too.","Khi biết được tình hình, họ cũng rất cảm động."
"A 56-year-old woman in Gaozhou City, Guangdong Province, was sentenced to six years with a 20,000-yuan fine on September 22, 2023, for practicing Falun Gong, a spiritual discipline that has been persecuted by the Chinese communist regime since 1999."," Một cư dân 56 tuổi ở thành phố Cao Châu, tỉnh Quảng Đông đã bị kết án 6 năm tù và phạt tiền 20.000 Nhân dân tệ vào ngày 22 tháng 9 năm 2023 vì tu luyệnPháp Luân Công, một pháp môn tu luyện đã bị chính quyền cộng sản Trung Quốc bức hại từ năm 1999."
"Ms. Wu Youqing was arrested on September 26, 2022, and indicted on November 25 that year.",Bà Ngô Hữu Thanh bị bắt vào ngày 26 tháng 9 năm 2022 và bị truy tố vào ngày 25 tháng 11 năm đó.
"Presiding judge Tan Wei of the Maonan District Court ruled on January 30, 2023, to put her case on hold due to an unforeseen situation, but he took up her case a few months later.","Chủ tọa Đàm Vệ của Tòa án Quận Mậu Nam đã ra phán quyết vào ngày 30 tháng 1 năm 2023, theo đó tạm hoãn vụ án của bà Ngô do có tình huống phát sinh, nhưng ông ta đãxử lývụ án của bà vài tháng sau đó."
"He held a hearing in the Maoming City First Detention Center on June 29, 2023.",Ông ta đã tổ chức phiên xét xử tạitrại tạm giamSố 1 Thành phố Mậu Danh vào ngày 29 tháng 6 năm 2023.
"Prosecutor Dai Jianlan, judges Ke Xuejun and Pan Chuanghua, and clerk Tu Yuan were also present at the trial.",Công tố viên Đái Kiến Lan cùng các thẩm phán Kha Học Quân và Phan Sang Hoa và thư ký Đồ Nguyên cũng có mặt tại phiên tòa.
Ms. Wu’s two lawyers entered a not-guilty plea for her and she also demanded an acquittal.,Hai luật sư của bà Ngô đã biện hộ vô tội cho bà và bà cũng yêu cầu được trắng án.
She was pronounced guilty three months later.,"Ba tháng sau, bà bị tuyên án có tội."
"For details of Ms. Wu’s arrest and detention, see the first two related reports listed at the end of this article.","Để biết chi tiết về vụ bắt và giam giữ bà Ngô, xin vui lòng xem hai báo cáo liên quan đầu tiên được liệt kê ở cuối bài viết này."
7-year Prior Incarceration and Family Broken,7 năm bị giam giữ và gia đình tan vỡ
Ms. Wu’s latest sentencing was preceded by multiple prior arrests for upholding her faith.,Trước bản án mới này bà Ngô đã nhiều lần bắt giữ chỉ vì kiên định đức tin của mình.
She was given three years of forced labor (2005-2008) and four years in prison (2013-2017).,Bà bị kết án 3 năm lao động cưỡng bức (2005-2008) và 4 năm tù (2013-2017).
She was brutally tortured during her incarceration.,Bà còn bị tra tấn tàn bạo trong thời gian bị giam cầm.
A prison guard once forced her to strip naked to humiliate her.,Một lính canh từng cưỡng chế bà cởi trần để sỉ nhục bà.
"She survived years of abuse in detention and returned home, only to face constant harassment from the local authorities as they attempted to force her to renounce her faith.","Bà đã sống sót sau nhiều năm bị ngược đãi ở trong trại tạm giam và trở về nhà, nhưng chỉ để lại tiếp tục phải đối mặt với sự sách nhiễu từ chính quyền địa phương khi họ cố ép bà từ bỏ đức tin của mình."
"Before the persecution began, Ms. Wu’s husband was very supportive of her practice of Falun Gong and theirs was a happy family.","Trước khi cuộc bức hại xảy ra, chồng bà rất ủng hộ việc bà tu luyện Pháp Luân Công và gia đình họ là một gia đình hạnh phúc."
But Ms. Wu’s repeated arrests after the persecution began proved to be too much for her husband to bear both mentally and financially (she was fired from her job at a Rural Credit Cooperative while she was held in a labor camp).,Nhưng việc bà bị bắt giữ nhiều lần sau khi cuộc bức hại bắt đầu đã khiến chồng bà gánh chịu quá nhiều cả về tinh thần lẫn tài chính (bà bị sa thải tại Ngân hàng Tín dụng Nông thôn trong khi bị giam cầm trong trại lao động).
He lashed out at her and often beat her savagely.,Ông ấy mắng nhiếc và thường xuyên đánh đập bà rất dã man.
He eventually filed for divorce while she was in prison.,"Cuối cùng, chồng bà đã đệ đơn ly hôn bà trong khi bà đang bị cầm tù."
"By the time she was released from prison, her ex-husband had remarried but she did not resent him or his family.","Tại thời điểm ra tù, chồng cũ của bà đã tái hôn nhưng bà không hề oán hận ông cũng như gia đình ông."
She still visited her ex-parents-in-law with her son on a regular basis.,Bà vẫn thường xuyên đến thăm bố mẹ chồng cũ cùng con trai.
"Eight Falun Gong practitioners in Guan County, Shandong Province, were still sentenced to prison for their shared faith in Falun Gong after a retrial."," Tám học viênPháp Luân Côngở huyện Quan, tỉnh Sơn Đông vẫn bị kết án tù vì đức tin của họ vào Pháp Luân Công sau phiên tòa xét xử lại."
One of them even had his sentence increased by three years.,Một trong số họ thậm chí còn bị tăng mức án thêm 3 năm.
The eight people were arrested between May and August 2022 for making materials that expose the Chinese Communist Party’s persecution of Falun Gong.,Tám học viên đã bị bắt từ tháng 5 đến tháng 8 năm 2022 vì làm tài liệu để phơi bày cuộc bức hại của Đảng Cộng sản Trung Quốc đối với Pháp Luân Công.
"The Guan County Court held a virtual hearing of their cases on December 21, 2022, and sentenced them to prison on January 4, 2023.",Tòa án Huyện Quan đã tổ chức phiên tòa trực tuyến xét xử các vụ án của họ vào ngày 21 tháng 12 năm 2022 và tuyên án vào ngày 4 tháng 1 năm 2023.
"Ms. Zhang Yuxiang, 51, and Mr. Xu Hengkui, 60, were both sentenced to 7.5 years and fined 18,000 yuan.","Bà Trương Ngọc Hương (51 tuổi) và ông Hứa Hằng Khê (60 tuổi) đều bị kết án 7,5 năm tù và phạt tiền 18.000 Nhân dân tệ."
"Mr. Kong Dequan, 61, was given 7 years and 4 months with a 16,000-yuan fine.",Ông Khổng Đức Toàn (61 tuổi) bị kết án 7 năm 4 tháng tù và phạt tiền 16.000 Nhân dân tệ.
"Mr. Zhou Chunbao, 48; Ms. Gao Shuzhen, 47; Mr. Han Zhenlin, 71; and Mr. Zhang Bingliang, 68, were each sentenced to 4 years with a 10,000-yuan fine.","Ông Chu Xuân Bảo (48 tuổi), bà Cao Thục Trinh (47 tuổi), ông Hàn Chấn Lâm (71 tuổi) và ông Trương Bính Lượng (68 tuổi) mỗi người bị kết án 4 năm tù và phạt tiền 10.000 Nhân dân tệ."
"Mr. Wang Ruixiang, 55, was given 3 years and fined 8,000 yuan.",Ông Vương Thụy Tường (55 tuổi) bị kết án 3 năm tù và phạt tiền 8.000 Nhân dân tệ.
All eight practitioners filed appeals in late February 2023.,Tất cả tám học viên đều nộp đơn kháng cáo vào cuối tháng 2 năm 2023.
The Liaocheng City Intermediate Court ruled on April 17 to overturn their original guilty verdicts and returned the cases to the Guan County Court on May 6 for a retrial.,"Tòa án Trung cấp Thành phố Liêu Thành đã ra phán quyết vào ngày 17 tháng 4, tuyên bố hủy bỏ bản án có tội ban đầu của họ và trả lại hồ sơ vụ án cho Tòa án Huyện Quan vào ngày 6 tháng 5 để xét xử lại."
"The Guan County Court refused to hold the retrial, so the Chengguanzhen Court was instructed to take over.",Tòa án Huyện Quan từ chối tổ chức xử lại nên Tòa án Thành Quan Trấn được chỉ thị tiếp quản.
The latter court retried the eight practitioners around August 2023 and convicted all of them again.,Tòa án Thành Quan Trấn đã mở phiên tòa xét xử lại 8 học viên vào khoảng tháng 8 năm 2023 và kết án tất cả họ một lần nữa.
Mr. Zhang had his sentence increased from 4 to 7 years.,"Ông Trương bị tăng án từ 4 lên 7 năm, còn tất cả các học viên còn lại đều giữ nguyên mức án ban đầu."
All the other practitioners’ sentences remained the same.,"Gần đây, họ đều đã nộp đơn kháng cáo một lần nữa."
They have all recently filed appeals again.,Sáu lần giamgiữ trong cácTrại tạm giam
Six Serving Time in Detention Centers,Bà Trương hiện đang bị giam tại trại tạm giam Thành phố Liêu Thành và ông Chu đang bị giam tại trại tạm giam Huyện Quan.
"More than three months have passed since Ms. Lin Jianping requested a hearing of her appeal, but she still has not had a response from her local appeals court."," Đã hơn 3 tháng kể từ khi yêu cầu mở phiên tòa cho kháng cáo của mình, bà Lâm Kiến Bình vẫn chưa nhận được phản hồi từ tòa phúc thẩm địa phương."
"Ms. Lin of Yantai City, Shandong Province, was arrested on February 6, 2022, for refusing to give up her faith in Falun Gong, a mind-body practice that has been persecuted by the Chinese Communist Party since 1999.","Bà Lâm ở thành phố Yên Đài, tỉnh Sơn Đông đã bị bắt vào ngày 6 tháng 2 năm 2022 vì không từ bỏ đức tin vàoPháp Luân Công, một pháp môn tu luyện đã bị Đảng Cộng sản Trung Quốc bức hại từ năm 1999."
She was released the same day after the local detention center declined to admit her due to her poor health.,Bà đã được thả ra trong ngày sau khitrại tạm giamđịa phương từ chối tiếp nhận bà vì sức khỏe kém.
She has since remained out on bail.,Bà vẫn đang được tại ngoại kể từ đó.
"Ms. Lin was tried on December 19, 2022.",Bà Lâm bị đưa ra xét xử vào ngày 19 tháng 12 năm 2022.
"She was sentenced to three years and fined 5,000 yuan on March 28, 2023.",Bà bị kết án 3 năm tù và phạt tiền 5.000 Nhân dân tệ vào ngày 28 tháng 3 năm 2023.
"She filed an appeal with the Yantai City Intermediate Court, which assigned the case to judges Wu Guoyan (+86-535-6675306), Gai Boxian (+86-13361398889), and Wu Jing.","Bà đã nộp đơn kháng cáo lên Tòa án Trung cấp Thành phố Yên Đài và vụ án được phân công cho thẩm phán Ngô Quốc Nham (+86- 535-6675306), Cái Bách Tiên (+86-13361398889) và Vũ Tĩnh."
"Judge Wu Guoyan deposed Ms. Lin on June 16, 2023.",Thẩm phán Ngô Quốc Nham đã lấy lời khai của bà Lâm vào ngày 16 tháng 6 năm 2023.
"While signing her name on the deposition, she also wrote, “My sentence was a major injustice.","Trong khi ký tên vào lời khai, bà cũng viết: “Bản án của tôi là một sự bất công lớn."
"I request a public hearing to redress the injustice in accordance with the law.” Wu commended her on her neat handwriting and Ms. Lin said, “The court should be a place to uphold justice and I of course must be serious and write my statement neatly.”",Tôi yêu cầu một phiên tòa công khai để sửa lại sự bất công theo quy định của pháp luật.” Ngô khen ngợi nét chữ gọn gàng của bà ấy và bà Lâm nói: “Tòa án phải là nơi đề cao công lý và tất nhiên tôi phải nghiêm túc và viết lời khai của mình một cách ngay ngắn.”
"Wu, however, has never told Ms. Lin or her non-lawyer defender whether a hearing would be held.","Tuy nhiên, Ngô chưa bao giờ nói với bà Lâm hoặc người bào chữa không phải luật sư của bà về việc có mở phiên xét xử hay không."
"On July 5, 2023, Ms. Lin and her defender submitted a legal opinion to the Qixia CityProcuratorate, which was responsible for her indictment.","Ngày 5 tháng 7 năm 2023, bà Lâm và người bào chữa của bà đã đệ trình ý kiến ​​pháp lý lên Viện Kiểm sát Thành phố Tê Hà, nơi chịu trách nhiệm về bản cáo trạng của bà."
The document requested that the wrong done to Ms. Lin be redressed.,Văn bản yêu cầu sửa lại bản án oan sai cho bà Lâm.
The clerk who received them listened carefully and recorded their conversation in a notebook.,Người thư ký tiếp họ đã lắng nghe cẩn thận và ghi lại cuộc trò chuyện của họ vào một cuốn sổ.
She said she’d report Ms. Lin’s concerns to the higher-ups and ask what the procuratorate could do.,Cô ấy nói rằng cô ấy sẽ báo cáo mối bận tâm của bà Lâm lên cấp trên và hỏi viện kiểm sát có thể giúp gì.
Ms. Lin’s defender asked the clerk to pass the legal opinion to the officials in charge and the Public Prosecution Division of the procuratorate.,Người bào chữa cho bà Lâm đã yêu cầu thư ký chuyển ý kiến ​​pháp lý cho các quan chức phụ trách và Phòng Công tố của Viện kiểm sát.
"Ms. Lin and her defender next went to the Qixia City Police Department, which carried out her arrest, and submitted the same legal opinion to its Appeals Division.","Kế tiếp, bà Lâm và người bào chữa cho bà đã đến Công an Thành phố Tê Hà (nơi thực hiện vụ bắt giữ bà) và đệ trình ý kiến ​​pháp lý tương tự lên Phòng Khiếu nại của Công an thành phố này."
An officer took the legal opinion and went to ask for directions from higher-ups.,Một cán bộ lấy ý kiến ​​pháp luật và đi xin ý kiến chỉ đạo từ cấp trên.
"He came back to say, “Even if we did wrong, we can’t correct our own mistakes.”","Ông ta quay lại nói: “Ngay cả khi chúng tôi làm sai, chúng tôi cũng không thể tự sửa chữa sai sót của mình”."
"On July 27, 2023, officer Sui Shuliang from the Appeals Division of the Qixia City Police Department called Ms. Lin’s defender and asked if he had submitted Ms. Lin’s legal opinion to them.","Ngày 27 tháng 7 năm 2023, cảnh sát Tùy Thư Lượng từ Phòng Khiếu nại của Công an Thành phố Tê Hà đã gọi điện cho người bào chữa cho bà Lâm và hỏi liệu ông ấy đã gửi ý kiến ​​pháp lý của bà Lâm cho họ chưa."
Ms. Lin’s defender confirmed that he had.,Người bào chữa cho bà Lâm xác nhận là có.
He and Ms. Lin learned later that Sui was the second-in-command of the Domestic Security Office of the Qixia City Police Department.,"Sau đó, ông và bà Lâm biết được rằng Tùy là Phó đội trưởng Đội An ninh Nội địa của Công an Thành phố Tê Hà."
"Sui said Ms. Lin’s case was no longer with the police department, implying that they were no longer responsible for her situation.","Sỹ quan Tùy cho biết trường hợp của bà Lâm không còn thuộc thẩm quyền của Công an, ngụ ý rằng họ không chịu trách nhiệm về tình trạng của bà nữa."
Someone from the Qixia City Court called Ms. Lin the next day to summon her to the courthouse.,Một người nào đó từ Tòa án Thành phố Tê Hà đã gọi điện cho bà Lâm vào ngày hôm sau để triệu tập bà đến tòa án.
"She asked why, but the caller refused to tell her.",Bà hỏi tại sao nhưng người gọi từ chối nói cho bà.
"Ms. Lin then asked to speak to judge Han Liguang (+86-18596132061), who’d sentenced her.","Sau đó, bà Lâm yêu cầu được nói chuyện với thẩm phán Hàn Lập Quang (+86-18596132061), người đã kết án bà."
The caller obliged and passed the phone to Han.,Người gọi buộc phải chuyển máy cho Hàn.
"Ms. Lin asked why she was being summoned, and Han said it was about her appeal.","Bà Lâm hỏi tại sao mình lại bị triệu tập, Hàn nói rằng đó là do đơn kháng cáo của bà."
Ms. Lin reminded him that her case now rested with the intermediate court and that he could talk to her defender if he had any questions about the appeal.,Bà Lâm nhắc ông ta rằng hồ sơ vụ án của bà hiện đang ở tòa án trung cấp và ông có thể nói chuyện với luật sư của bà nếu có bất kỳ thắc mắc nào về vụ kháng cáo.
"Not long after the phone call, judge Han showed up at Ms. Lin’s door along with another judge and two female court workers.","Sau cuộc điện thoại, thẩm phán Hàn nhanh chóng xuất hiện trước cửa nhà bà Lâm cùng với một thẩm phán khác và hai nữ nhân viên tòa án."
"They rang the doorbell but Ms. Lin didn’t open up, and they left.",Họ bấm chuông nhưng bà Lâm không mở cửa và họ bỏ đi.
Past Persecution,Bức hại trước đây
This is not the first time that Ms. Lin has been targeted for her faith.,Đây không phải là lần đầu tiên bà Lâm bị chính quyền nhắm đến vì kiên định đức tin của mình.
She previously served three years in a forced labor camp and another three years in prison.,Trước đây bà từng phải thụ án 3 năm trong trại lao động cưỡng bức và 3 năm khác trong nhà tù.
She was brutally tortured while she was incarcerated.,Bà đã bị tra tấn dã man trong khi bị giam giữ.
"With Ms. Lin’s latest appeals case still pending, her daughter has a hard time sleeping at night, worried her mother could again be thrown into jail and tortured.","Với vụ kháng cáo mới nhất này của bà Lâm vẫn đang chờ kết quả, con gái bà mất ngủ vào ban đêm vì lo lắng mẹ mình có thể lại bị tống vào tù và bị tra tấn."
